ID,hc_related,description
2631,1,"President of Healthcare IT Consulting and Staff Augmentation Firm, Pharmacy IT/ Informatics, Cerner, Meditech"
2632,0,Music producer & manager
2633,1,"Committed to developing innovative products and therapies that bring natural, long lasting relief to dry, irritated eyes."
2634,0,Brasileira 
2635,0,LIFE IS A STRUGGLE AND DEDICATION
2636,0,Tbilisi
2637,0,"motivational, gregarious,creative"
2638,0,"Director Tribuna Deportiva 
Radio Paraso 103.5 FM
"
2639,0,"Directioner, Belieber & Breezy Forever! 
SGUEME & TE SIGO :D
Instagram:"
2640,0,Just Freedom...
2641,1,"100% Natural Low Glycemic Energy Bars for people with diabetes, athletes and the health conscious"
2642,0,"AS A DAUGHTA , VIRGO, SOCIAL & CREATIVE LADY, I LUV 2  IN D ENTER OF ATTENTION. I AM FIRM & HAS D QUALITIES IN LEADERSHIP, EPITOME & XPRESSION OF GOD'S GLORY."
2643,0,Consultor . Estratega . Padre de Familia
2644,0,"Flagraphics is a leading manufacturer of custom flags, banners, awnings, digital graphics, and architectural solutions. We proudly serve clients worldwide!"
2645,0,This page left blank intentionally.
2646,0,"Jarocho en Puebla, amante del caf, la montaa y la cerveza... sobreviviendo a la vida, desamores y buscando ser Neurocirujano "
2647,1,This is the official twitter for Kaiser Permanente in Riverside County. 
2648,1,Physician & Scientist; 66 yrs. old.At Clinical Practice: Male & Female Sexual Dysfuntions.In Research: Human and Animal Studies about Sex. FCM-UNICAMP-SP-Brazil
2649,0,23
2650,0,Inhale. Inspire. Integrate.
2651,0,Love 4 All Hatred 4 None
2652,1,MD.
2653,1,"San Diego biotechnology & life science research and professional jobs from SDBN, 5-10 posted daily. Browse, apply for, and post jobs at "
2654,0,It's nice to have a account.
2655,1,A 50 minute physical rehabilitation exercise video designed and developed for women recovering from breast surgery.
2656,1,"TCAA offers programs that address hunger relief, support for senior independence, homelessness prevention and intervention, and health outreach services."
2657,1,Saint Luke's Health System includes 10 hospitals and provides a range of services in metro KC and the region. Social media policy: 
2658,0,"Take care of your body, its the only place you have to live"
2659,0,"-Galeno- Give hope. You may be someone's last... -Este corazn es clsico y anticuado, disculpe las molestias.-"
2660,0,"Tweet on current affairs , RT's Are Not Endorsements , stand against hate /Bigotry"
2661,0,Fndr/CEO/Crtv Dir @ Eternal Sol Ent. 
2662,1,hematologic oncologist w/focus in multiple myeloma & plasma cell disorders 
2663,0,"My candle burns at both ends;    It will not last the night; But ah, my foes, and oh, my friends   It gives a lovely light!  First Fig. Edna St. Vincent Millay"
2664,0,"All Sconnie. Level 98 fidgeter. Passionate about UX. Tweets are my own. End racism. If you wouldn't say it to their face, don't Tweet it."
2665,0,Advancing research by serving scientists with sample preservation and storage.
2666,0,"Of course I love my Denver sports. Huge Rockies, Broncos, Nuggets and Avalanche fan."
2667,0,Collaborative 
2668,0,"Married, Work from my man-cave, kayaker, mt. biker, Photographer, practice random acts of kindness, and an antique dealer. Plus I dabble in marketing."
2669,1,Healthcare consulting and practice brokerage.
2670,0,PhD Education Researcher. Classical Musician. Mom. Grandma. I'm basically an artsy nerd who loves her kids.
2671,1,"Writer, Author, Poet, Traumatic Brain Injury Survivor, Voluntary Service Specialist at a hospital."
2672,0,"Days are challenged exploring the wrld of digital. By night, I dabble in this, I dabble in that, but mostly design, art & fashion accessories keep me inspired."
2673,0,"Ken Preston Obama Grassroots Organizer 2008/2012 Obama Delegate Rochester, NY"
2674,1,"Writing about safety and quality in healthcare. Society to Improve Diagnosis in Medicine, "
2675,0,Micah 6:8
2676,1,Medical Field & Day/Swing Trade Stocks & Options.
2677,1,"Employed by Mercy Health System, Janesville, WI since 1994. Currently Marketing Specialist III."
2678,0,Marathoner. PB&J Connoisseur.
2679,0,"Nati-Amer-New Age Medicine, Pro Bus Woman, company 5 Feathers; Business & Personal has its place. My unique style helping Your Unique @ 810-348-9118."
2680,1,"Naturopathic Physician. Poet,Human Rights Activist, Crisis counselor, &Author-A Guide to Health(Natural Medicine),Whisperings from within,poems by  Emeka Mokeme"
2681,0,I am taking life one day at a time...
2682,1,The Home Care Alliance of Massachusetts is a non-profit trade association of home care providers in Massachusetts. Call us at (617) 482-8830.
2683,1,Nature scenes lower stress and elevate the patient experience in the healthcare setting
2684,1,Ruth Lilly Health Education Center @ Marian University | Teaching Health Because Lives Depend On It
2685,0,"27


don't judge my choices without understanding my reasons. "
2686,1,Urology Resident at WesternU
2687,0,"Child of God, Artist, Counseling ministry, encourager, wildlife/animal/cat lover, Love u All! Rejoice! God's Mercy is new everyday! Embrace the Joy of the LORD!"
2688,0,Intern 
2689,1,"President and CEO, Claret Medical"
2690,1,HIV/AIDS worked within the communities since 1986
2691,0,Ability is what you're capable of doing. Motivation determines what you do. Attitude determines how well you do it. -Lou Holtz
2692,0,"""Curar a veces, aliviar a menudo, consolar siempre"""
2693,0,"Hard working American that is conservative, believes in the true American values.God, Pro family, pro guns, and pro life"
2694,0,Associate Vice President 
2695,0,Programs advisor for girls and young women at the Global Fund. Working in seven countries.
2696,0,Founder & CEO 
2697,0,"Enterprise editor of the San Antonio Express-News: transportation, water, environment, social services, health etc. etc."
2698,0,"Marketing Communications, Owner of Violet Rose, hockey mom of 3 boys, married to "
2699,1,"The NYC Healthcare Innovation Group - 5000+ patients, health pros, innovators, and investors dedicated to finding, founding, and funding the future of medicine."
2700,1,Your local source for better information and better health.
2701,0,"Fascinated by macroeconomics, opera, symphony, & history"
2702,0,lifetimestudent
2703,0, of 
2704,1,"Health and Nutrition Educator,Counselor, Speaker, Wellness Coach, Registered Dietitian"
2705,0,"Living the unfettered life, Trader/Investor, and Hobby Jogger/Triathlete."
2706,0,Wife & Mom 
2707,1,"Doctor, Health Planner, and Broadcast Journalist  
"
2708,0,"Love God, my hubby Tony,  my friends"
2709,0,"VENEZOLANO/ CREO EN DIOS!, NO AL RGIMEN!"
2710,0,El Costo no tiene nada que ver con el Valor
2711,0,Exclusive access into the mind of Kristin.
2712,0,"Empower PR will put your message on TV, radio, print and the internet, driving sales. We represent businesses, law firms, hotels, restaurants and famous people."
2713,1,"Happy-go-lucky cancer survivor. I love God, people, animals, nature, sunshine, cooking, laughter and I've always wanted to be Rainbow Brite. That says it all."
2714,1,"The Journal of Health and Medical Informatics is an international, peer-reviewed journal elaborating the application of computers to health care."
2715,0,"A down-to-earth, happy-go-lucky guy, who is just making it up as I travel through life, adding a virtual laugh track here and there to amuse others and myself."
2716,0,"Love life, live life. I want my country back to normal. 
No DM 
 "
2717,1,I am interested in helping and making positive impact in people's lives Advocating and campaign for a better form of livelihood for the physically challenged
2718,0,"Writer, Speaker, Coach and Consultant, helping leaders and organizations to achieve extraordinary results through innovation and reinvention."
2719,0,Del Ray resident. Long suffering Mets fan. Brown dog enthusiast. Federal relations professional. Views are my own.
2720,1,nurse practitioner :-) Independent Herbalife coach
2721,1,"Sports Medicine Chiropractic
Nutritional blood testing
Allergy blood testing
Ah"
2722,0,One from Egypt
2723,0,"Reader, Runner, music fan, entrepreneur, finance and politics."
2724,0,writer
2725,1,Believer. RN. Account Specialist. Elite Baller. I Can Do All Things Thru JC..
2726,1,"Association of Nurses in AIDS Care - ANAC - is the only not-for-profit, 501(c)(3), national professional association specifically for HIV/AIDS nurses."
2727,0,Never Give up for some..thing..
2728,0,"Established in 1914, the Cleveland Foundation is the worlds first community foundation and one of the largest. Join us, and be a part of the bigger picture!"
2729,1,"Sprightly communicator for various nonprofit, academic and medical-type places."
2730,0,senior writer/director research communications 
2731,0,17.  /-.../-../-./  .  .      .
2732,1,Autoimmune Warrior | 
2733,1,"Researcher and psychologist (eating disorders, obesity, genetics, PTSD), mom, wife, traveler, foodie, yogini."
2734,1,Self-identify as a biophysicist. Currently living the postdoc life. Interested in how thermodynamics define protein function. 
2735,1,Dr. Quynh Do
2736,1,"I'm juzt a doctor, catholic and happy"
2737,1,"With the landscape of nutrition changing rapidly, Bluebonnet Nutrition isnt simply changing with it, were leading the way to better health."
2738,0,"A brand a reputation consultancy, helping clients create award winning, perfectly executed strategies."
2739,0,IG: UmoruIdris 
2740,1,"Senior Communications Specialist, Cedars-Sinai. Bird-watcher. Science fan."
2741,0,"BeautySleep is the beauty enhancing sleep drink. Made with essential sleep aids, antioxidants and vitamins to help you fall asleep easily and nourish your skin."
2742,0,Lancaster-Eagle Gazette reporter
2743,0,"Integrador de sistemas, consultor y CFO de UNISYS Corporation, certificado en proyectos de ingeniera de diseo, comunicaciones y estructuras de servidores."
2744,0,"Rob Reinalda: Editor, writer, raconteur, actor, "
2745,0,"Investigative reporter for PIX11 News; tennis player, movie buff, proud mom; daughter of Irish immigrants. Instagram "
2746,0,"We are a Oklahoma based store that provides fun, trendy, and eco-friendly cloth diapering and baby products for mothers and growing families."
2747,1,Retired RN. Football fanatic!!! I will follow Johnny Football Manziel wherever he goes!!
2748,0,Are you a Heartosaurus?
2749,0,Very dedicated to my family.
2750,0,"Father, Solicitor, and Friend."
2751,0,Married my high school sweetheart and fireman hero!  We have had 6 sons together.  My full time job is taking care of my wonderful guys.
2752,0,Donostiarra. Cirujano cardiovascular. Apasionado de lo mo y de los mos.
2753,1,Physical therapist//Boston fanatic\\Fluent in sarcasm
2754,0,Connector| MBA| Legacy Builder| Proud Mentor| Dope Soul 
2755,1,"Medicine, Boston and Clemson Sports "
2756,0,"~Always been a philosopher, researcher, educator, life long student, & Humanitarian. Belief in a Higher Power, Dignity & Standing for The Cause. Wise up.~"
2757,0,"Try not to become a man of success, but rather try to become a man of value."
2758,1,"Outdoor Lover, Writer, Traveler, Oakland Proud. Breast Cancer Diagnosis, November 21, 2016; Second Diagnosis, September 23, 2018."
2759,1,Ames-Grenz Insurance Services was established in Dec. 1968 and provides employee benefits: 
2760,0, & 
2761,0,twitter twitter little star ;)
2762,0,Coach to Leaders & Teams worldwide
2763,0,Learning to Fly. Combustion Research for AeroSpace 
2764,1,"Leading software communications company for healthcare/life sciences. Online discussion platform engages HCPs. When engagement matters, companies choose Within3"
2765,1,"PHARMACEUTICAL  SUPPLY CHAIN SPECIALIST,PHARMACIST,DISTRIBUTION IN SOUTHERN AFRICA.contacts:+26876398518,+26825052317,+26825054189,ginjon20@yahoo.com,"
2766,0,"Work as a Senior Software Engineer at BAE Systems IT, originally from karachi, in usa since 1995"
2767,0, & 
2768,0,Absofuckinlutely just me.......
2769,0,"Female Owned; Est Yr. 2000, Private Label Mfgr; Fetish Adult Novelty Company. TSX Toys manufactures more extensions than any company in the entire world!"
2770,0,"Hiking,  Fitness ,Sports . Philadelphia Phillies,  Super Bowl champion Philadelphia  Eagles "
2771,0,"Unlimited human power comes from strong mind; confidence, courage, commitment, control, purpose; this is the recipe.."
2772,0,"author, analyst, commentator"
2773,0,Be passionate about what you do!
2774,0,God 1st x Forever ! Happily married sarcastic enthusiastic mum to 3 
2775,1,Private Medical Practice in internal medicine and cardiology. Professional and personalised medical services.Conceriege medical care provider-Program+
2776,1,Whitecap Health is a strategic advisory firm dedicated to the healthcare sector
2777,1,"Family medicine resident,       
Proud KSU graduate"
2778,1,The best ideas in medicine for kids.
2779,0,"Grandmother of 6 and loving it. Winner of a Chile Cook Off. Enjoy reading, writing, and gardening. On a journey to good health via exercise and Paleo eating."
2780,0,Universal blep.
2781,0,"It's about growing your business and entrepreneurial spirit, what's slowing and what's growing your business.

It's marketing, finance, networking and more!"
2782,0,Science reporter on the poison beat/Sunday news editor 
2783,0,"
"
2784,1,"Prof,Dr. , Hematology, Director of HSCT and Hemapheresis"
2785,0,I'm only human
2786,1,"President of MethodSense, a Life Science service company focused on the convergence of Quality, Regulatory Affairs and Technology. "
2787,0,The mission of E. W. Fashion is to provide exceptional mans dress shirts.
2788,0,Pelajar abadi
2789,0,Sabanc University
2790,1,"Speaker-Entrepreneur-Attorney. Wife, mother, daughter, friend, rare disease survivor.  PATRIOT."
2791,0,Explore the world of luxury travel with me.
2792,0,God's princess 
2793,1,"Be part of the conversation about hearing loss and hearing aids. Directory and reviews of U.S. hearing professionals. 
Facebook: "
2794,0,Fans Fanatik Persib And Milanista I Nesta in San Siro
2795,0,bandung
2796,0,Veeeemk veeeem ! ;]
2797,1,"Epidemiologist, Breast Cancer Researcher, Health Writer, Science Geek."
2798,0,Work: Executive Producer at 
2799,0,We are Beautiful in our own way. :)
2800,0,Love Jesus/Doctor/Love my fams and friends also Gummy Kelly/Music/I'm thankful for every single thing that happened in my life.El Seor Jess es todo para m.
2801,0,Wife. Mother. Writer/editor. Penn Stater. Opinions are my own.
2802,0,Biomedico
2803,1,"A physician whose main interests are: preventive medicine, wound treatment, and technology in healthcare."
2804,1,Munther has over 20 yrs of experience in the pharmaceutical industry with deep domain knowledge in clinical trials execution model and emerging technologies
2805,0,"A ignorncia  uma especie de bno . Se voc nao sabe , nao existe dor  -- john lennon"
2806,0,"Let us always meet each other with smile, for the smile is the beginning of love. -Mother Teresa | NYITCOM Class of 2021| Macaulay Honors Class of 2016"
2807,1,The Salk Institute for Biological Studies is one of the world's preeminent basic research institutions.
2808,1,Clinical Instructor/Fellow Addiction Medicine @ University of Wisconsin
2809,0,"Works for Vitamix Corp! July 18, 1998 is the date I always remember. Wrote song called How Can I Say I'm Sorry (I Mean it)"
2810,0,||-// TP BanditoTour 10/21/18 
2811,0,      ... 
2812,0,"kalc ol dedim hayatmda ''KAL , ACI OL'' demedim..."
2813,0,iran
2814,1,If you are behind the curve on ICD-10...we need to connect!!
2815,0,galatasaray fanatii. hayvan sever pizza delisi
2816,1,"Father, foodie & New York City Native with a passion for outstanding customer service and hospitality in healthcare. My tweets are my own."
2817,0,eitim yneticisi
2818,0,Director of 
2819,1,Product Management | Life Sciences Marketing | Healthcare Innovation | Chemical Engineer & MBA
2820,0,How many more have to die? Always have a Designated Driver! Have fun and have the time of your life! Married to a Deputy Sheriff! Mother of Blake and Mackenzie
2821,0,"Acupuncture & Chinese herbs in Noosa, the beautiful Sunshine Coast, Queensland, Australia."
2822,1,"Exercise & nutrition program focused on getting you into the best shape of your life.  Results Guaranteed.
Facebook:  Operation Boot Camp Los Angeles"
2823,0,"""Make your life a dream and your dream a reality."""
2824,0,I help people & businesses w 
2825,1,"Get your Bachelor's Degree in Nursing!
Broward College
RN-BSN Program"
2826,1,Vitiligo is a chronic skin disease that causes loss of pigment
2827,1,"I was born in Brooklyn NY, to West Indian parents. Moved to Long Island, NY at 9. Now I go to American University and I'm a Junior/Bio/Pre-Med Major."
2828,1,"FNP, gerontology first "
2829,0,"One of the best Private Chefs in Toronto for Private Dinner Parties, Events Catering, Christmas Parties, Birthdays and Anniversary parties."
2830,0,"Baki Akbaba 

Roma Kuafor"
2831,1,I am retired and an Adjunct Psychology Instructor at the College of Southern Nevada.
2832,1,"The most comprehensive, fully integrated technology platform available to deliver optimized, continuous care between visits. Virtually."
2833,1,"Future Interventionalist. Interested in Coronary, Structural and Congenital Intervention, 3D Printing, Music and Fishing.

Hunting for Fellowships."
2834,1,I  wanna be  a great physician ... treating poor peoples for free  ...  charities everywhere around the world ..
2835,0,Mam dichosa. Salubrista por el 
2836,0,"The latest in science, every day!"
2837,1,Dr. Daniel A. Saltzman at the U of M is researching a cancer treatment with no side effects. Results are promising but more funding is urgently needed.
2838,0,bethlehem native. philadelphia attorney. daughter. sister. auntie. nittany lion. cousin. friend. fiance
2839,1,Health Care professional looking to network in elder care and rehabilitation.
2840,0,VENEZOLANA de pura cepa.
2841,0,Former Plain Dealer reporter/editor turned content developer 
2842,0,"We're your ally for success in all facets of business in today's volatile economy because we take on the detail work, to ensure your prosperity."
2843,0,"I like the smell of earth,the touch of waves, taste of berries, sight of trees,the feeling of being fully alive.Tennis lover and big admirer of Roger Federer."
2844,0,Happily married to a great guy
2845,0,Mother of two little monster zombies. 
2846,0,Professional Live Answering Service with Operators Based in the United States. With a Plan for your Every Need... We've Got Your Number!
2847,0,"    
     

     
     "
2848,0,Be yourself; everyone else is already taken.
2849,0,1day nje...
2850,0,Elizabeth Hamilton-Guarino | Founder/
2851,1,"We intend to educate & provide individuals and families with advice, innovative tools and products that promote a holistic healthy lifestyle. Whatever you do..."
2852,1,"Healthcare laundry, disposable cubicle curtains, blind and curtain cleaning, maintenance, supply and installation, window film and re-upholstery."
2853,0,"Harry Bosk, PR & Photography, story teller, runner,dog owner, fan of O's, Ravens and Hopkins lax"
2854,0,Bday: September 8
2855,0,Author of The Art of Control: Developing Your Intelligent Emotions & Managing Your Life -Executive Coach to CEOs & College/University Presidents
2856,1,Developed workflow and healthcare systems. Currently working from home for a startup. My sons add to the chaos.
2857,0,Not exactly a good girl.
2858,0,Hoping to be in Smash Bros DLC
2859,1,"Exercise Physiologist, Nutritional Consultant, Optimistic, Business Dev. Enthusiast, Marketer, Healthy Aging, and Brutally Honest"
2860,0,book reader. kitchen mess maker. pop culture onlooker. grammar stickler. doting dog mother.
2861,0,publisher and journalist
2862,0,Check out 
2863,1,"Campaign for the healing arts and sciences devoted to maintaining the health of the teeth, gums"
2864,0,Humanitarian and Animal Lover
2865,0,The worlds first-ever 3D resistance training system.
2866,1,"Nurse practitioner
doTERRA wellness advocate
"
2867,1,"Population, Health and Development Consultant. I am Pro-People."
2868,0,"KNOWLEDGE is POWER...Change is inevitable, but GROWTH is a CHOICE... Na'miste ya'll....(sing: ma-ma-say-ma-ma-saw-ma-ma-coo-sah...)(repeat).."
2869,0,Being to hell and back. I have got vouchers and open bubbles
2870,0,life is shorter than you think
2871,1,"Caridad Center is the largest free healthcare clinic of its kind in FL, providing health/dental services to the uninsured, working poor families of Palm Beach."
2872,0,"Me llamo leandro y soy una persona muy sincera cuando hay que serlo , me gusta la chacota hacer amigos, pero sobre todo las personas sinceras de corazn."
2873,0,Beauty and Health Concierge for anyone at any age and situation. We visit your home and make you feel and look good.
2874,1,"Dartmouth College '91, NYU Med '95, Wash U trained urologist with interests in endourology, BPH, and MIS. Views are my own."
2875,0,games
2876,0,Freehold Shrewsbury Howell Toms River Manchester Little Egg Harbor Lakewood Manahawkin Lacey
2877,1,"Dedicated Wife, Parent, Physician, Ocean lover."
2878,1,"Masters of Public Health Graduate, Avid Reader, Science Lover"
2879,1,"Soccer, healthcare, but really just soccer."
2880,0,"Business Owner, Realtor,Life Coach, Speaker, Entrepreneur, Political Pioneer."
2881,1,MD
2882,0,To Know You is To LOVE You!!  wife 
2883,1,"dad, husband, quality improvement, safety, systems, teams, kidneys | ex-Harkness Fellow "
2884,0,Soul Motivator.Immortal Life Coach. mackensonn25@yahoo.fr
2885,1,"Freelance writer/editor of health, business, human interest"
2886,0,:P Sigueme Y Te SIGO.. *_*
2887,0,PR/Communications Pro & Leader 
2888,1,Healthcare design researcher; evidence based design; design consultant; former nurse
2889,0,ntabb
2890,1, Empowering you and our planet's health on issues that matter
2891,0,Negociadora Internacional.
2892,0,"CEO & Founder of Real Estate Solutions HQ, Inc."
2893,0,Help change the world 
2894,1,Products designed by Wound Care Specialists for Wound Care Specialists
2895,0,Gamer *w* ...
2896,1,"I formed the North Peak Group in 1993.  I specialize in Information Technology (IT) recruiting, mostly in the Hospital / Clinical Informatics industry."
2897,1,"Biosurgery Specialist in Nashville, TN                            Former Southern Coaster"
2898,0,"pizzza delisi,uykucu,ok ak,futol hastas,TRABZON SPORR ,ronaldooooo"
2899,0,"Xennial. 
Dissenter of the so called President. A so called American.
Noble Plebeian.
Ego redemi in veritate."
2900,0,"political, sports,entertainment"
2901,0,"Journalist, podcaster, "
2902,1,We are the premier provider of non-medical homecare in Arizona.  Send us a tweet for more info.
2903,0,"We strive to give foster, adoptive, and kinship parents the knowledge and tools they need to raise children who will thrive in todays world."
2904,0,Software Developer
2905,0,My life in emojis 
2906,0,"Entrepreneur, sport enthusist,counsellor to the youth,an original never dying a copy........."
2907,0,"Ambrose Nwaopara is a prolific writer and a renowned life coach, especially in the area of achieving success, both in relationships and other life endeavors."
2908,1,"Tracking what's next in medical innovation from hospitals, payers, medtech, pharma, digital & beyond. A "
2909,1,Opinionated Primary Care Pharmacist. often disgruntled always correct. Beer. pop culture. politics. views my own; many declarations - 
2910,1,"Passionate About Healthcare, Science & Technology Innovations that will shape the Future Advocate for UBI and cryptoassets Travel addict - Insta: micaontherun"
2911,0,"Odontologa Lser. Profesionales Especialistas en Odontologa General e Infantil, Diseo de Sonrisa, Ciruga Bucal, Endodoncia e Implantes. Tecnologa Lser."
2912,1,"We deliver expertise and solutions to the ultrasound community providing healthcare and biomedical professionals with systems, parts, service and training."
2913,0,kra 16a #82-46 unidad mdica del country consultorio 309 telf 2960557
2914,0,20.God's worshiper
2915,1,"Registered Dietitian, Exercise Physiologist, Certified in Sports Dietetics. Author of the new Hip-Hop Nutrition - Volume I "
2916,0,"{} Do not fell perfect because god is all perfect {} I always evokes words myself, I have the power, ability, and has a high quality "
2917,1,"Healthcare consumer engagement, telehealth and navigation solutions for health plans and providersvia the power of personal connection. 25K interactions daily."
2918,0,tidak semua insan menyadari bahwa yang dikejar-kejar itu telah tersimpan menyelinap dalam lubuk hati sanubarinya
2919,0,Many years in the Arab World
2920,0,RG Staffing Resources offers you a team of highly trained 
2921,0,"Your days are numbered.  Use them to throw open the windows of your soul to the sun.  If you do not, the sun will soon set, and you along with it. - Aurelius"
2922,0,I love my life and the people in it!  
2923,0,"'In the end, we will remember not the words of our enemies, but the silence of our friends'. King Jnr."
2924,1,Foot Healers is a full-service podiatry clinic with a total commitment to keeping your feet healthy - and keeping you happy.
2925,1,"Oral&Maxillofacial Pathologist,DDS,PhD "
2926,1,Studying Health & Public Policy; Loves traveling & eating; Trying to change health outcomes through food & policy. 
2927,1,Covering the latest trends and offering in-depth analysis that healthcare executives need to make crucial decisions.
2928,0,Architect & dog daddy
2929,0,"Husband2HotWife, Father Coach Dad to 11-Cool Kiddo's. Commercial Real Estate-Dallas/USA Wolfpack Wrestling Alum"
