ID,hc_related,description
1,1,"Fellow at HMS Center for Bioethics, Nurse Practitioner, Bioethicist, Husband and Dad. Amateur lobsterman. Blogger for Petrie-Flom. Opinions are my own."
2,0,"Executive Producer, "
3,1,Certified Neonatal Nurse Practitioner/ Academic 
4,0,Founder and content curator of Alpha HT. Alpha is the premier alternative development platform for Haiti and other pre-frontier markets in the Americas.
5,1,Promoting a Safe and Drug Free Roanoke Valley
6,0,PROFESSIONAL ACTOR AT MACHACHARI TV SHOW
7,1,PT-MPT|| Neuroscience ~~ Such a mysterious place
8,1,Passionate about racial justice & reproductive health. Lover of pandas. JD/MPH. Arizona girl. Proud three-time 
9,1,"Health, Wellness, and Fitness"
10,0,"Houseofdona film production company...  of movies, comedy and many more"
11,1,Official twitter of Dr abdirahman who service humanitarian and health .  Bachelor of puplic health 
12,0,Real man always believe In Yourself and put your trust in God. Love is my religion Peace.
13,0,Nutricionista Clinico Postgrado Pontificia U.Javeriana. Bogot    Especialista Nios ~Adultos.Consulta Y Asesorias Online +584121107514
14,0,Allahu robi
15,0,Professor of cooking and confections. Thanks for stopping by!
16,1,An emergency medical persomnel.
17,1,"History Health Fitness & Wellness Humanitarian ""The hardest thing to learn in life is which bridge to cross and which bridge to burn."" - David Russell"
18,1,"MD candidate, "
19,1,Black-owned non-profit organization empowering our communities by making medicine/health easier to understand. 
20,0,A SOCIALIST/ART LOVER/PAINTER/TRAVELER/MOTIVATOR /POETRY-RANDOM THOUGHTS!!!
21,1,"Society for Advanced Spinal Intervention aims to educate, train and credential physicians on a worldwide scale."
22,0,fanatica de la musica
23,1,Synergy for a healthier world
24,0,Writer/Reporter 
25,1,"Feng Shui for Modern Living is an online magazine that explores Feng Shui and the secrets of Health, Wealth and Happiness. Great articles, tips and advice."
26,0,Music and Dogs
27,0,live the moment
28,0,"Hi,I am Tanjila  Meghla .Nickname is Era.I am a professional graphic designer certified by George Washington University, USA."
29,0,muscican at simple blacks band
30,0,I'm a simple and calm.. Easy to be with... And I like being with  top top people........ Because im so special.....
31,1,Hematology/Oncology fellow. My interests include 
32,1,"University of Houston-Clear Lake student, healthcare professional"
33,1,plastic surgen
34,1,Biohealth healthcare. Pharma enthusiast.
35,1,Florida Eye Specialists is Northeast Florida's largest group of Board Certified Fellowship Trained Surgeons. The Premier Center for all of your Eye Care needs.
36,0,"Chunky chocolate girl. Fun loving love all electronics, knowledge lover avid book reader. Love other cultures people from eveywhere."
37,0,Rhode Islander. Gentleman. Scholar.
38,1,", Family, Oncology Research, Photography, Traveling, Texans!"
39,0,"Nama sahrudin ,lahir bima ,tgl 10 maret 1985 ntb"
40,0,Ifsa turk lezbiyen porno sex twerk videoariniz gizli cekim fotalari gizlilik icin atabilirsinz paylasilir istendigi takdirde geri kaldirilir
41,0,"Mom, Design Enthusiast, Investor, UrbanBaby Co-Founder, Set Designer, Esquire Fashion Editor"
42,1,"FeminaCafe is project about Health,Animals,Fitness,Celebrities, and News. Website: "
43,0,PRESIDENT
44,0,"Expert-driven, practical online "
45,0,Sports Soccer NFL Sports WWE NBA Track & Field Olympics Wrestling MLS Fantasy sports Track & Field Basketball
46,0,San Diego native 
47,1,A comprehensive health care service delivery network of the Provincial Government of Tarlac with medical specialists and sub-specialists as frontliners
48,1,"Official account of the Italian Society of Immunology, Clinical Immunology and Allergology. Tweets by the SIICA Junior Faculty."
49,1,"Rudy Andriani M.D. | New York, New York | Retired Urologist | Passionate about "
50,0,Postdoctoral Fellow at 
51,1,Cardiovascular surgeon
52,0,"STREET TEAM FOR ALL BLACK ROSE ENT ARTISTS!
GET YA PROMO RIGHT!
"
53,0,Safety. Camaraderie. Environment
54,1,Physician from Riyadh
55,1,I'm a biomedical researcher currently studying cellular adaptation to metallic environments.
56,1,"GI dietitian@TJUH in Phila,Pa17+yearsRD@Celiaccenter&Fattylivercenter#weightmanagement#glutenfree#lowfodmap#ibd#ibs#gastroparesisdietspecialist"
57,1,"I'm Matt, and I work in the chemical deposition industry with an emphasis on decontamination strategies."
58,0,Editorial Intern at Ms. Magazine
59,1,Our CLIA & ISO 15189:2012 accredited DNA testing lab offers 
60,1,Find everything you need to know about HCG USA | HCG for Weight loss | HCG Reviews and which HCG Diet is the right one for you! 
61,1,Emergency Medicine Specialist
62,1,"Fitness & health expert
this program will make you look younger"
63,1,"Medical City of McKinney is a state-of-the-art hospital in McKinney, TX"
64,0,.genti
65,0,"my name is Grace from United Kingdom ,"
66,1,"A multi-disciplinary group of worldwide experts focused on education and management in atherosclerosis, lipid disorders and their complications. "
67,1,Physician/Activist/MandelaWashington Fellow2016/BOBA
68,0,Insurance Agent for 25 yrs. I love my Country and I am 100% a Trump Deplorable.
69,0,Dra
70,1,I am an advanced practice nurse and consultant holistically advocating for optimum health within the context of one's personal health values.
71,0,ShoeBrela is the original umbrella for your Shoes. Made with high quality materials to keep your feet and shoes clean.
72,1,"Associate Prof. of Urology, Medical Education, Obstetrics & Gynecology (Female Pelvic Medicine & Reconstructive Surgery) "
73,1,Alra Care Products are scientifically formulated to soothe and relieve the effects of chemotherapy and radiation treatment which cause serious skin irritations.
74,1,Paradise Community Living (PCL) Health Care is the Premier international medical tourism agency made up of accredited 
75,1,#health#fitness#weightloss#diet#ebook#book#followme#followback#nutrition#cancer#diease#heart
76,1,Registered Nurse currently continuing education 
77,1,"Medical Staffing & Healthcare  Professional referral to ;Hospitals ,Medical clinics, Nursing homes and Psychiatric facilities."
78,0,Laugh For The Health of It 
79,0,the love of your life
80,1,medicine  
81,0,President of 
82,0,                        !!
83,0,SPTE 
84,0,VP Client Solutions 
85,1,"Board Certified Massage Therapist @ Healing Arts Indy, downtown. Indiana MT21003793, BCTMB 592185-10, AMTA Professional Member; specialize in pain relief."
86,1,Just minding my own ignorance. No political affiliation but centrist traits have been noted. Healthcare & Scientific innovation are my life. Own views
87,0,"Specialty Investment Bank | Origination, Sales, Trading, Remarketing, Advisory of Debt Products, Fixed Income, Equity Securities | Nonprofit & Corporate Banking"
88,1,ACGME & AOA Accredited National Family Med Residency Program & Teaching Health Center. Proud to be training family med residents in urban underserved DC.
89,0,Just mommy & her little hunny bun 
90,0,"Programmer, Designer, Thinker, Innovator."
91,0,Bio
92,1,"Founder of Dynavision.  Manufacturer of cutting edge high performance\rehab evaluation, training and  measurement devices."
93,1,Hospitalist-Internal Medicine
94,0,Islam is the Best - Proud that I am Muslim
95,0,SocialMedicine.it  il SocialNetwork per soli medici.
96,1,BA(Hons) Media Studies BNU
97,0,Prof 
98,0,Be Unforgettable.
99,0,"Politically inclined, One of d bravest of mankind's, Lover of History, Cutest and handsomely endowed."
100,0,notice me Ice T
101,0,Pondering great philosophies.
102,0,"Retired, Conservative,Dgt. of CG Capt, Niece of Baatan POW, Catholic, N.R.A., Patriot Guard, Pro-Life, Follow doesn't mean agree"
103,1,Hope in Motions Walk & Run supports the Stamford Hospitals Bennett Cancer Center. The event is held annually in June on National Cancer Survivors Day.
104,0,born to learn
105,0,Me: a definition of Awesome 
106,0,I am in a relationship with Lisa Serio and I'm planning to marry her. I like talking with Crystal Hendricks and others on Facebook and play Candy Crush Soda
107,0,"My Name is Kaiya Galloway 
I am 2 Years Old 
I have Acute Lymphoblastic Leukemia
I love playing with my Big Brothers and my Doggies"
108,0,Profesora de francs y tb de ingls -  NO MIRA TELEVISIN
109,1,"Health Informatician. Interests include dogs, nature, food, fibre art, beauty "
110,0,      . ''  !()    .
111,1,Nurse with a Mission
112,1,"Physician at 1000 Beded General Hospital, Nay Pyi Taw, Myanmar"
113,0,Christianity
114,1,"functional nutrition specialist, health coach, educator, author"
115,0,Estoy para darle trabajo a la mente
116,1,"PGY1 pathology resident. Polish girl. Love cats, pilates and fashion. "
117,0,"God fearing, son and husband teacher young star jnr"
118,0,"Yogi, Meditator, Sanguine, adventurer, in love with love "
119,0,"Referral Orders is a free online referral system that allows people to Refer clients to other professionals, Rate their services and Vouch for them."
120,0,", "
121,0,Arizona 
122,1,"Sydney sport & exercise physician, Chief Medical Officer Tennis Australia. Sports lover and amateur cook."
123,1,A doctor giving up years of my life to add years to yours!
124,0,Kennari 
125,0,caring and intelligent..just that!!
126,1,"Recently graduated physician from San Marcos University, Lima, Peru, with a keen interest in cancer"
127,0,Murphy's Law was established in 1997 and has been a staple in the Upper East Side bar scene ever since.
128,1,"Over 25 years experience in all phases of HR, benefits administration, classification, T&D, labor relations, and HRIS."
129,1,25th European Symposium on Urogenital Radiology. Barcelona 13th-16th September 2018
130,1,"Midway Ambulance Care Servicing Wynyard, Wadena, Foam Lake, Rose Valley and areas. In partnership with Saskatoon, Kelsey Trail & Sunrise Health Authorities"
131,1,struggling with medicine 
132,0,Mdico. 350ml de cafena c/12 hrs. Nunca juzg una pelcula sin antes verla. Aficionado de los deportes
133,1,French/USA/UK Registered Dietitian/Culinary Nutritionist. Food/Health Blogger and owner at 
134,0,BECOME A LEADER
135,1,"Food Microbiologist and a proud Nutritionist

Talk to a Nutrition expert today"
136,1,Clarifi is the non-invasive saliva test that aids in the early diagnosis of autism spectrum disorder in children ages 18 months through six years.
137,1,"Medical student at Universit degli Studi della Campania. Aspiring surgeon and film critic. Art, movie and acting lover. "
138,1,"Transforming health and health care in Maine, and New England, by leading, collaborating, and aligning improvement efforts."
139,1,"Pediatric nephrologist, mom of three, trying to be a human"
140,0,wadi AMBAR
141,1,A manufacturer and supplier of high quality laboratory consumables; supplying products for science around the world since 2012.
142,1,The Society of Interventional Oncology serves as the only member-based organization dedicated to the emerging field of IO. (Est 1/17/17)
143,0,"The Arizona Board of Regents governs Arizona's universities, including Arizona State University, Northern Arizona University, and the University of Arizona."
144,1,"IBMer, Healthcare media relations, exhausted mom of 2, yogini, Texan; views are my own!"
145,0,"The Official Twitter account of Dr. Stephen L. Berman's daughter, Horace Mann, author & winner of the Marquis Who's Who Albert Nelson Lifetime Achievement Award"
146,0,come leave a follow and maybe subscribe! did u know if u have amazon prime or twitch prime u get to sub to ur favorite twitch streamer free! YouTube is braap
147,1,It's time for a health plan with a new perspective. Yours. We're AllWays Health Partners.
148,1,M.D. candidate. Views are my own
149,0,Cik Nabila :)Do follow me. Add me on Fb. 
150,0,TocMxico Centro especializado en el tratamiento del TOC (Trastorno Obsesivo Compulsivo) y trastornos relacionados. Citas: (55)15559560
151,0,"Mdico Ortopedista, egresado INR"
152,0,"New fashion brand. Unique creations that want to be a trend for the future. Tee, sweatshirt and fashion accessories.
Follow our creations ..."
153,1,"When you've been told there's no hope, we can help with complex spine treatment. "
154,0,CEO and Co-founder of 
155,1,I am here to tell people best foods and herbs that they can use for life to keep away illness
156,1,Med student 
157,0,"Husband, Dad, Step Dad, Son, Brother, Cousin, Friend, Student, and forever Marine"
158,1,      . Pediatrics and adult Spine & Scoliosis surgeon          
159,0,Co-Founder & CEO 
160,0,Always follow your 
161,0,...takip eden takip edilir...
162,1,Author of The Get Real Diet (
163,1,Resident physician at The Ohio State University. Budding Nephrologist.
164,0,"Internista-Diabetologo, hobby lector y coleccionista de libros. Dueo de Capricream's Barquisimeto(helados de leche de cabra)"
165,1,Heartland Health Centers operates 16 community health centers that provide high-quality care to individuals and families regardless of their ability to pay.
166,0,Lifelong Progressive fighting GOP and Corporatized Democratic hypocrites with truth. Still and always a Sanders supporter.
167,1,Official lab twitter of the Tothova Lab 
168,0,Just a person trying to survive
169,1,"The Athletic Training Department is responsible for the prevention, evaluation, treatment, and rehabilitation of all athletic injuries for UMW student-athletes."
170,0,Jeune tudiant malien 
171,0,limited states
172,1,"Medscape Dermatology provides you with breaking medical news; reference on drugs, diseases, and procedures; and free CME."
173,0,virtual diary; angry bitter melon on internet lyfe; speaks english well with thicc indonesian accent
174,1,"Medscape Emergency Medicine provides you with breaking medical news; reference on drugs, diseases, and procedures; and free CME."
175,1,"Medical student, photographer, traveller & lifelong nerd."
176,0,"
"
177,0,"If I can help and change even one persons life for the better, my time here on earth will not have been wasted."
178,0,Hooomaaaan..
179,1,Cardiac Nurse 
180,0,Human Resources/Recruitment Consultant. Career Coach. Social Media/Networking Guru. Faculty Member and Mentor 
181,1,Medical Interpreter/Translator
182,1,"Computational evo biologist, Assistant Prof at Cal State San Marcos "
183,1,Im a student at Stanford University and I love genetics and human data.
184,0,"Mi hijo busca novia, preferiblemente mayor que el, tiene 10 aos y juega fornite"
185,1,Periodontics lecturer 
186,0,Banker
187,1,Helping Africans find second opinion about their cancer diagnoses and treatments | info@expertreachout.com
188,1,Cardiovascular wellness specialist. Tweets are not medical advice. Aiding in the prevention and reversal of heart disease without drugs Non invasive screening
189,0,"Distributor, Interested to collaborate as trusted channel partner for Pakistan.
Email: info@lifeelements.com.pk"
190,0,Consider the source.
191,1,"Just a guy.  Health care professional, blogger, and frequent sayer of stupid sh!t.  wrote for the old "
192,0,        .
193,1,Oncology Research Nurse
194,1,"A Family Medicine Clinic with your family in mind! We provide services such as Vitamin B12 Energy Shots, Physicals and more to help you be your best!!"
195,1,"Medicine, Psychiatry, Neurosciences, Psychotherapy, Sports Psychology, High Management, Behavior Analysis, Taekwondo & mental health research."
196,1,Pediatric NP Johns Hopkins Childrens Center Dept General Peds Surg
197,1,vegetarian Travel Urgency Medicine recycling
198,1,A biotechnology company with a portfolio of first-in-class nicotine-blocking drugs to treat diseases caused or worsened by nicotine.
199,0,"creative and intuitive, can't do without good friends."
200,0,"Mdico, culiacn Sinaloa, fantico del genero kaiju y la ciencia."
201,1,MedStudent 
202,1,"MD, DNB(Path)
OMC "
203,0,lil dude from across tha street
204,0,All news and announcements of 
205,0,MAST '22 
206,1,Regulatory Affairs Professional with interest in Infectious.  
207,0,"Mdico Internista, graduado ULA, Mrida, Venezuela. Consultas: Av. Lpez Aveledo. Centro Profesional Plaza. 4to piso. Ofic 4- C Lunes, martes y viernes 3:00 pm."
208,1,Healthcare Public Policy Researcher Documentary Filmmaker Public Speaker Writer Blogger Photographer (
209,1,medical student 
210,0,"Ya olduun gibi grn, ya grndn gibi ol Mevlana Celalettin Rumi (A poem by Rumi : Either appear as you are or be as you appear)"
211,1,"Np: I WON'T GIVE UP....  
"
212,1,University of Miami MD/MPH Program: a four-year dual degree program that offers an integrated curriculum to become a public health physician.
213,0,mimiedhyr congkang 16125 :) ({})
214,0,"""Atmano mokshartham jagad hitaya cha""
For one's own salvation, and for the welfare of the world."
215,1,Fueled by coffee. Equal parts yogi and medical nerd. I like stabbing people with needles for money.
216,0,"Ordain minister, deacon, conference evangelist, Christian educator, Missionary superintendent, chaplain, seminary student, entrepreneur, teacher, God's Girl."
217,1,Breast Cancer Survivor-Mom-RN
218,0,Culinary Solutions for the Modern Palate
219,0,10/30/17
220,0,Poetista admirador del cantante urbano mas sincero y humilde de la rep.dom team poeta 
221,0,Last of a dying breed
222,0,Patient persistence and perspiration make an unbeaten combination for success 
223,0,Tcu
224,0,Fighting for the causes you care about and making the MetroWest/495 Corridor a better place. 
225,0,"La Clnica Internacional de Alta Tecnologa CLINALTEC, es una institucin diseada para prestar servicios integrales para el tratamiento integral del cncer."
226,1,Our mission is to save lives by improving lung health and preventing lung disease. Posting Guidelines 
227,1,"Registered Dietitian/Nutritionist, Mom to 2.5 kiddos, lover of all things melted cheese."
228,0,Development Manager 
229,1,"Unique, innovative psychotherapy practice in Northern Virginia offering compassionate care for children, teens, and adults with depression, stress, & anxiety"
230,1,"PhD student nursing scientist studying sedentary behavior and cancer. Clinical Exercise Physiologist, Health Promotion & Disease Prevention."
231,0,I represent the 16th ward of Chicago's worst  
232,0,Founder/CEO 
233,0,Twitter Oficial de SOA (Dra. Catalina Gonzlez Pons y el Dr. Eduardo Segura Gonzlez).Facebook:
234,0,patologa pediatrica/ pediatric pathologist Hospital de Pediatria Garrahan
235,0,i am a simple girl
236,0,We enhance the overall experience of traditional Italian cuisine just adding certain ingredients and complexity without changing the core of the Italian Classic
237,0,O Segredo  ser simples eo essencial  ser voc mesmo!
238,1,"Future Doctor , Currently Premed "
239,1,Current MD MPH student. Raised in San Francisco. Patient Advocate. Social and reproductive justice.
240,1,"The Solution for Managing Practitioners, Tests, Medications, Appointments, Procedures, Finances, and the Emotional Aspects of Your IVF Journey"
241,0,18DanielPadilla's WifeDancerSingerFanof booksKdramaFan
242,1,"Section of General Internal Medicine, Lewis Katz School of Medicine at Temple University "
243,0,Inefable.
244,1,Clinical trauma psychotherapist. Waiting for our  species to wake-up.   Recovering from Western civilization & sugar addiction.  My hero: Thich Nhat Hahn.
245,1,The premier site online for finding the right drug rehab center or alcohol treatment center for you or your loved one. (888) 502-3530
246,0,Nada AKA Learner AKA BMS
247,0,Developed 
248,1,Dr shahidullah dawar
249,1,MPH Candidate 
250,0,MR Physicist 
251,0,"    
     
   
   
    !"
252,1,"University of Miami Grad BSN, RN specializing in Geriatric Acute Care"
253,0,"I'm nothing without God, I'm everything with God. He provides my needs, for my wants are selfish and unnecessary. Praise the Lord, I am a child of God."
254,1,Your Medical Writing Department
255,0,Baby Doctor Mamas is a podcast for new parents made by physician mothers specializing in newborn medicine.
256,0,Happy with life!
257,1," .     .
Dr Najeeb Layyous Center for Infertility-IVF-Gynecology Obstetrics
"
258,0,Entrepreneur | IT Freak | Ex-banker | Poet | Lyricist | Lover of God | Liverpool FC fan |
259,0,oncologa medica
260,0,"There's only us. There's only this. Forget regret, or life is yours to miss."
261,0,"Directioner,Cherlloyd,Me,Myself and i, pls. follow me follow u back promise"
262,0,Personal Account. For business inquiries: salfadil@jhmi.edu
263,1,Academic hospitalist 
264,0,PARAMOUNT MMA ANNOUNCER 
265,0,Quality Control
266,0,Happy person
267,0,"grateful heart
animals are the best
history repeats itself"
268,0,Sub duohka
269,0,"Ordained Minister, Churchanity ain't my thing, BUT, Faith, Hope & Love I have in my heart. Come meet My Jesus, he's more so much more than you even know! "
270,0,Im a day dreamer & a night thinker | Caffeine-fermenter | RMT
271,0,"Turismo comunitario, rural, alternativo o como le quieran llamar pero hganlo. Incursin en los temas del mundo digital e informacin ciudadana"
272,0,"Living the country life , retired with my husband of 53 years. Have 4 children , 9 grandchildren, love all of them .."
273,1,Curing cancer one tweet at a time
274,1,accelerated nursing student trying to survive while drowning! I should be studying 
275,1,Nurse. Blogger. Speaker. Med-Surg | ICU | Trauma | Injury Prevention. Have a great shift!
276,0,Train your mind to see the good in everything....
277,0,BeLiEvEr|TeAcHeR|HuStEr|SiMpLe|RiCH|DaMigod.
278,1,The Youth Rally is a camp for young people ages 11-17 with bowel and bladder diversions.
279,1,"Manufacturer & Supplier Scrub Uniforms & Lab Coats  
We Offer 
your logo 
Your Label and Tags.  
Contact us 
Whats app +92 336 808 2020 info.ringpower@gmail.com"
280,0,. he/him/his. 
281,0,"Animal Rights Advocate, Vegan"
282,1,I am a Certified Associate in Project Management and also a certified personal trainer. Im currently in school at ASU to get my BA in Health Science.
283,1,"Director of Gastroenterology & Endoscopy at John Hunter Hospital from Newcastle, Australia. Current interests include Hepatitis C, HCC and Gut microbiome."
284,1,"Pediatrics and Neonatology International Summit is going to be held in Tokyo, Japan during October 30-31, 2019. "
285,1,"This is a Twitter account for those who are going through cancer, have survived cancer, or those who have lost someone to cancer. "
286,0,Free Bird.....!!!
287,1,Gastroenterology/Hepatology Fellow 
288,1,Welcome to the official Twitter of the Brown University General Psychiatry Residency Training Program. 
289,1,my stethoscope feeds me!  friday nights
290,0,We create digital strategies for business growth. 
291,1,is an integrated diagnostic and clinic centre aimed at serving the community through the provision of 
292,1,Ghanaian with a BSC in Human biology and aspires to be an international public health consultant
293,1,"My name is Jason Barrett and I have Lymphoma. As such, I started "
294,0,"I am a retired bank executive of 47 years. I have a wife of 46 years, 2 grown boys, 2 daughters in law and a 10 yr old Grandson. Life is really good."
295,1,"Dr. Horwitz is a Clinical Psychologist in Durham, NC. He is a member of the American Academy of Psychotherapists, and the American Psychological Association."
296,0,"""ACTIVIST IN THE PUBLIC INTEREST"" Advancing Environmental & Social Justice_Indigenous People_Peace_Free Speech_Human Rights   "
297,0,We are a pick up and delivery service for laundry and dry cleaning.  Proudly serving commercial and residential customers.
298,1,Sharing our journey and teaching others how to Live Healthy Naturally with 100% Pure Natural Therapeutic Grade Essential Oils. Gifts of the Earth. Start TODAY!
299,1,medical student from UM(1)
300,0,Football for life CR7 IS THE BEST VIVA RONALDO HALA MADRID
301,1,US Tele-Medicine is the leading telemedicine care provider for America's largest employers throughout the United States.
302,0,Trying to save the world one good deed at a time.
303,1,I am currently voluntarily admitted to  a psych hospital. 
304,0,Obsessed with the beach & green tea Providing creative & digital talent solutions 
305,0,My daughter is the only thing I have for now 
306,1,Biochemist. Writer. Soccer player. Dog enthusiast. PhD candidate at Johns Hopkins.
307,0,"Married,with 3 children, live, own and work on a 40 acre farm. I am a Plexus Ambassador!I also have chickens, a dog and cats. LOVE the country life!"
308,1,"Committed to high-quality, affordable health care, "
309,0,Reach beyond your limits
310,0,Sergzet-i Tababet /Zilkade/ Koni'
311,0,|
312,1,Pediatric Nurse Practitioner - Primary Care
313,1,A network of multidisciplinary physicians committed to clinical research and the advancement of regenerative medicine using adult stem cells. 
314,1, is an educational resource website designed by Sally an OTR/L for people facing challenges caring for a loved one.
315,0,drama queen
316,1,Developmental and Cellular Neuroscientist.
317,0,"Media 3D, a Scottsdale, Arizona-based multimedia production company, provides 3D animation, motion graphic, video post- production and product design services"
318,0,"Born Again Christian man . My life is all about Jesus Christ and living a Christian life . Studying Gods word .In the Morning when I wake , Give me Jesus "
319,1,"Cardiologist at Piedmont Healthcare in Atlanta, Georgia, USA"
320,1,Iam a clinical psychologist with passion for developing psycho oncology in Kenya and Africa.
