ID,hc_related,description
5242,0,Delighted to serve you our Authentic Gourmet Wrapped with our Traditional Hospitality. We import our spices exclusivly from Lebanon to serve the original taste!
5243,1,Board-certified Neurosurgeon
5244,0,"foodie,traveller,dreamer,designer,marathoner,writer,no regrets,live every moment as if it's ur last,shape shifter,blessing in disguise"
5245,0,Believe in 'Knowledge is in air spread it far'.. Three year old weekly free digital magazine with 
5246,0,La passion des corps masculins athltique ! The passion of athletic male body ! La pasin del cuerpo masculino atltico !
5247,1,Director of Nursing Simulation
5248,0,Geneticsy | Adventure seeker
5249,1,"Join us from August 29 - September 1, 2014 in Boston, Massachusetts, USA to discuss the future of excellence in Pediatric Burn Care."
5250,1,The UC Merced chapter of the oldest and largest national premedical association of physicians-in-training. 
5251,1,Dietetics/Nutrition major at ASU. On the path to becoming a physician assistant.
5252,0,"Reach me direct 917-447-7210 Fort Lee, NJ 2014615000 "
5253,1,"Interests in Innovative technologies in healthcare, Ashtanga Yoga, Travel, keeping sane on minimal sleep"
5254,1,"Professor of Medical Oncology, University of Palermo, Italy - Director of Medical Oncology Unit, AOUP P. Giaccone Palermo - Scientific Director of "
5255,1,Irelands National Centre for Dermatology Research and Training. Our researchers look to discover new treatments and therapies for patients with skin diseases.
5256,1, offers a wide range of contact lenses and accessories at great prices.
5257,1,"Circle Care helps people connect with Quality Cosmetic Plastic Surgery Providers in an easy and reliable way.
An Elite Cosmetic Plastic Surgery Network"
5258,1,The NREF supports research and education efforts that enhance and confirm the critical role neurosurgeons play in improving lives.
5259,0,"Independent thinking southerner with interests in many subjects, people and places! All views are my own..."
5260,1,"Registered Nurse. Passionate about my family, Neuroscience, pharmacology, MS research, current book I am reading, Soundgarden, Foo Fighters"
5261,1,Pediatric anesthesiologist; Medical Director Pediatric Pain Rehabilitation Center (PPRC) Program; interested in pain management data visualization; Acupuncture
5262,0,"A women of mystery n power, whose power is exceeded only by her mystery. Living vicariously through myself."
5263,0,"Carol Zutler was born in Union City NJ, Carol Zutler is a mother of 3 grown children and a wife to Daniel P Zutler for 30 years."
5264,0,", tu dosis diaria de consejos saludables para el bienestar de vos y tu familia."
5265,0,Fun. Fat. Fabulous. Getting in shape. Losing weight. Loving life. Blogger.
5266,0,Medicine x Research | sapere aude
5267,0,Medicina-UCA
5268,0,AF Brat-Navy Vet-Ret. Corrections-1WestPac- 
5269,1,The official Twitter for NutriBullet University - A hands-on education & healthy eating experience for students. 
5270,0, |  
5271,1,Finished MBBS  from yenepoya medical college. Mangalore. Working as a chief medical officer at Udma speciality nursing home ..
5272,0,LMSW / 
5273,1,Understanding the brain by providing the details of the big picture: Super-resolution neuro-imaging.
5274,1,Rockland Hospitals is an integrated Healthcare provider with a network of 3 Multi-Super Specialty Hospitals (808 beds) located in Delhi NCR (India).
5275,1,GV Health develop & manufacture: environmental 
5276,0,Community Manager 
5277,0,"Writer, Photographer and Cyber Security Enthusiast"
5278,0,I aim to make the world a better place for humanity and me. peace always
5279,0,am good at Wat am doing nd are enjoy doing it...
5280,0,"Any state, any entity, any ideology that fails to recognize the worth, the dignity, the rights of man, that state is obsolete - Rod Serling"
5281,0,"Creative Strategic Executive. Designer, Blogger, Mother and Christian."
5282,0,my tweets are my Bio
5283,1,"My int'l. blog shares my journey with mom who has Alzheimer's. ""My Mom My Hero"" book available on Amazon. My new book ""Letter To My Mom"" available on Amazon"
5284,1,"MCN Learning is comprised of compliance and regulatory experts, education and clinical professionals with decades of experience."
5285,1,"Affordable, effective pain relief and maintenance care."
5286,1,. CNMS-RN
5287,0,"Hola, I am here to have fun looking at famous people, my friends, and family."
5288,0,"Former Pastor at Living Truth Center in East Cleveland, OH. Is now a Staff Minister at Christ Universal Temple where the Rev. Dr. Derrick B Wells is the Pastor."
5289,1,We mobilize doctors & medical students to be leaders in putting 
5290,0,Lifestyles and entertainment from The Herald and 
5291,1,"I'm a palliative care advocate, writer, and podcast host giving a much needed voice to palliative care specialists and patients."
5292,1,"CPC, CPMA, Healthcare, Compliance, health and wellness RYT 200"
5293,1,*California Girl *Kidney Transplant (x2) & Kidney Cancer Survivor *Dialysis Life *Kidney Warrior *Blogging about living with FSGS an invisible kidney disease *
5294,0,To tweet or not to tweet
5295,0,"from Louisiana, living abroad... really into life, concerts, podcasts, music "
5296,0,cities policy markets finance sports fitness travel
5297,0,"This is Andy from CN GENOUR POWER S.A.(TAIZHOU MINGPAI TRADE CO.,LTD). DEAL IN: Gasoline Generator  Generator(1-2-6kw) AND SPARE PARTS whatsapp:8613616688891."
5298,0,Nutricionista-Dietista //Diplomado en Soporte Nutricional Enteral y Parenteral
5299,0,Associate at Crowell & Moring LLP. DOJ Tax Division alum. Views my own.
5300,1,Writing all kinds of thoughts about having metastatic breast cancer in the modern world.
5301,1,"Pharmacist/Chemist, MLS, Politician, Road safety ambassador, philanthropist."
5302,1,"Following Science and Providing New Natural Solutions to Health, Wellness, and Slowing the Aging Process!  Recruiting & mentoring goal oriented entrepreneurs."
5303,1,"The Wisconsin Womens Health Foundation helps Wisconsin women and their families reach their healthiest potential. 
Because it all begins with a healthy woman."
5304,0,male
5305,0,Broker/Sales for Ozarks Home Realty
5306,0,"I love life. I love my family, the military, and the body I was blessed with to push to the limit every second."
5307,0,"Mom of a Beautiful daughter, my Rock, fighting "
5308,1,Med Student
5309,1,ReShape Lifesciences Inc. (NASDAQ:RSLS) is a developer of minimally invasive medical devices to treat obesity and metabolic diseases.
5310,0,Sr. Recruiter
5311,1,The Society for Mucosal Immunology (SMI) promotes excellence in research and education in mucosal immunology and fosters communication among immunologists
5312,1,"An integrated, professional approach to health. Nourish United States seeks to transform the health and wellness landscapes through yoga, nutrition, and massage"
5313,0,"History repeats itself. Most of the time it is the same old stuff, just a different day. We add some commentary and press criticism of journaltainment."
5314,0,Being persistent is the best way of living in life:)
5315,0,I Am.
5316,0,A forward thinking Special Needs Mom who works as a SM Director for a Nat'l Country Music Radio Show. Starting a 
5317,0,"Francine Vale: Author: Song of the Heart - Walking the Path of Light, Angel Healer, Talk Radio Host, visionary."
5318,1,"wife, dog owner, omnivore dietitian, agvocate, public speaker, writer, founder of "
5319,0,"To live is the rarest thing in the world. Most people exist, that is all. 
-Oscar Wilde"
5320,1,"a Worshipper, a Missionary and beauty queen by heart, Licensed teacher, Future Doctor, princess of God, a leader, loves nature tripping and photography"
5321,0,Supporting 
5322,0,Proud Indian 
5323,1,We are procedure prep. Enhancing patient engagement & streamlining back office workflow. Endorsed by 
5324,1,Universal Health Coverage for all citizens of the Earth is still a dream that is in reach.
5325,1,"Advocate,Certified Professional Mediator(CPM),Healthcare Professional and Development Enthusiast."
5326,1,advocate MD/psychiatrist
5327,0,One of the best apartment communities in metro Atlanta. Near DeKalb Farmer's Market & Historic Decatur 
5328,0,"Dndote buenas razones para no seguirme desde 2014. No en serio, soy mdico, y de las buenas!. Me gusta la psiquiatra y la medicina familiar..."
5329,1,Kimberly is currently a clinical pharmacist with the University of Utah Health Care who works with patient's to manage their medications and disease states.
5330,0,Aloha
5331,0,PROUD 
5332,1,"As President of Alpha Delta Healthcare Consulting, Kevin has 25 years as a healthcare actuary and consultant; hes a subject matter expert in Medicare Advantage"
5333,0,Resource & Project Management Consulting | Entrepreneurship Trainer | Open Minded | Can-Do Spirited | Raising Champions | Loved | Expanding God's Kingdom
5334,1,"Your #1 source for health tips & pharma updates.
"
5335,0,"Grad of Marriage & Family Therapy, interning at Summit Counseling, happily married, love God with all my heart and not ashamed to say I want to glorify Him!"
5336,1,Registered Practical Nurse at a Toronto Hospital & Global Health BSc student at York University. These are my mere musings documented for the world wide web!
5337,1,"Lover of football and tennis. A passion for global public health issues,current affairs, and good music. Roll Tide!!"
5338,1,"We provide affordable, non-medical home care assistance to people of all ages. Call us 24/7: 877-491-4400 Metro Detroit"
5339,0,We are offer to you 
5340,0,                    \   Snap: M_babakr
5341,0,Nld Vzqz
5342,0,US 
5343,1,"Physician, Psychiatrist, Addiction Specialist, Media and Public Speaker, Healthcare Consultant, Founder - Physicians for Criminal Justice Reform"
5344,0,"I'm a devout Christian and a kind, patient person.I'm a martial artist.I love all sorts of music genres mostly country and rock and I love my family."
5345,0,"I am selfish, impatient and a little insecure. I make mistakes, I am out of control and at times hard to handle."
5346,0,Don't get up. I'm just passing through.
5347,1,"Medical student, NYFA Acting grad.

"
5348,0,mama. wife. cooperator. community member. views and opinions are my own.
5349,0,LifeSecure Insurance Company is dedicated to providing a different kind of insurance experience to help create a better future for our customers.
5350,0,Linguistics fan. Rural Virginia.
5351,0,Do your best
5352,0,"Counselors in Morganville NJ with decades of experience using motivational strategies for addictions, anger, school bullying and more! Call today (732) 817-0103"
5353,0,"Author & Book Writing Coach | Host: The Art & Business of Writing podcast | Get my new release, Mended Faith: "
5354,1,We are here to help people with low vision and blindness.  We have been in the business for the past 22 years.  Check out our website at www.lvsmn.com .
5355,1,"Mom, Online adjunct, Online ESL teacher, and Chiropractor in Bettendorf, IA"
5356,1,"Motto: Move Better, Live Healthier! Human Performance Specialist. Science Based Natural Healer / Acupuncturist / Corrective Exercise Personal Trainer"
5357,0,motherwifevolleyball playeravid sports loverwisconsin sport fan
5358,1,"Seeker of meaning, neurologist, photography enthusiast."
5359,0,Leading Designer of Custom Ergonomic 
5360,0,Trying to find the truth in the hype. My 98 yr old great grandpa said moderation is key.
5361,1,"Chair Florida Association of Nurse Practitioners, ARNP, Rural Healthcare Provider"
5362,0,Entrepreneurial Thinker - Koc'02 Sabanci MGMT'06 Bogazici SWE'09 uChicago MLA'12
5363,1,"Hardworking, oncologist-to-be, A and B student, learning enthusiast, creative, awesome, music loving, amazing, and funny girl!"
5364,1,Healthcare Business Owner. Former Royal Marine Commando. Tory. Liverpool FC ST.
5365,0,"Journalist,youtuber, innovator, work for bbc news"
5366,0,An 80's Guy....
5367,0,Though Leader | Formerly 25 years with Wal-Mart Stores | Cycling Enthusiast
5368,1,"BGSUAlumna pre-medicine
Just a young queen trying to pursue her dreams "
5369,1,"Ophthalmic Consultant.Health Care Quality Manager.
Professional Postgraduate Diploma in Health Care& Hospital Management.TQM Diploma for Health Care Reform.AUC"
5370,1,an optimistically happy cancer artist & writer... better known as a tata warrior
5371,1,Cardiologist; preventive medicine and heart is a key focus. Motivating you to live and enjoy. Life will continue mostly in moderation between extreme feelings.
5372,0,Psikoloji Odakl Eitim Merkezi
5373,0,Live with outrageous joy!
5374,0,The Graduate Career Management Center at the 
5375,1,"Certified Personal Fitness Trainer, Senior Fitness Specialist, group fitness instructor and  trainer at The Fitness Retreat! Believe!! Glory to God!!"
5376,1,"Sports Dietitian
Tulane Athletics & NFLPA Program
My Sports Dietitian ("
5377,0,Live.Love.Laugh.ThunderUp.
5378,0,Allah bir leyla iin iki mecnun yaratmaz...
5379,1,Health & Wellness Dietitian
5380,0,Erikoistuvan lkrin ajatuksia lketieteest ja terveyspolitiikasta. Terveyskeskus- ja yksityislkri Helsingist ideoimassa tulevaisuuden terveydenhuoltoa.
5381,0,12th President of the University of Memphis
5382,1,"Philadelphia area acupuncturist, Chinese herbal medicine practitioner, herb teacher at WON Institute. SWAC Boulder grad."
5383,0,Show me your 100 Watt smile! 
5384,0,Medicina Interna 
5385,0,"Mdico Neumonologo Fundacin ASCARDIO-CEDIT. Consulta Cesacin Tabaquica (Consejera Adicciones: Nicotina, Otras) Madre,  Barquisimeto, Lara Venezuela"
5386,0,"Southern Nazarene University, BS, 1997 / Oklahoma Christian University, MBA, 2006 / Account Manager OsteoNexus / Husband / Two Daughters / Renaissance Man"
5387,0,Strives to be the industry leader in bringing together job seekers and employers in the aquatic business job market.
5388,0,Iowa State Alum. I tweet about sports occasionally.
5389,0,Philadelphia Eagles/Sixers and New York Yankees. Government Affairs in DC. Tweets are not endorsements.
5390,0,Wise men speak because they have something to say; Fools because they have to say something.
5391,0,Interested in strategic comms & digital diplomacy| Communication Manager for Philips in SEE| Tweets are personal
5392,1,"Ob/Gyn, Educator, Mother of two. Tweets are my own."
5393,0,"Entrepreneural spirited-financially responsible devoted wife, mother  & grandmother. Patient to a fault. Lover of music, beach, chocolate & shoes!"
5394,1,"Nursing student, mom of 4, and a volunteer for many community/military organizations. Ohio State Buckeye fan, lover of wine, music and art."
5395,1,Specialist of digital innovation for pharmaceutical companies. We design digital solutions to improve life of patients & Dr experience  
5396,1,"Urology resident in DR, grateful daughter, loving wife, blessed mother of baby Franco."
5397,0,LOVE ALL TYPES OF SPORTS AND MUSIC.
5398,0,"God fearing, humble, like being myself and always cool."
5399,0,"Medico internista, caraquista"
5400,0,"     
             
  "
5401,0,Mdico Urlogo. Casado.4 hijos. U de Chile. Me interesa el perfeccionamiento profesional continuo.
5402,0,Bankac
5403,1,Nurse
5404,1,Tidewater Bariatrics is a non-surgical medically directed weight loss facility. Let us help you to regain your health...Eat Well and Move!
5405,1,"An egyptian medical student, volunteer worker, not a fan of any of the political intites in my country...but still has my own point of view..."
5406,0,"educate, advocate, network  "
5407,0,"I'm just a girl standing in front of the world, asking you to follow me!"
5408,1,"Past President IMO 2001   Emergency & Disaster Medicine Specialist, Sports Mad Opinions Mine ""Micktatorship"""
5409,0,"Medico Anestesiloga, en constante bsqueda de crecimiento Espiritual y profesional."
5410,0,I love well mannered girls and pretty sexy girls
5411,1,Retired from a career in IT. Founder/leader of pulmonary fibrosis support group in NJ. Organize annual 5K fundraiser for PFF. Play lots of bridge. Love the lake
5412,0,Teen Boy Mom-my favorite role | Wife | Daughter | Sister | Aunt | Learner | Teacher | Principal 
5413,0,Businessman in gold
5414,1,Ph.D. candidate in pharmaceutical sciences(pharmacognosy)-   -   -   -    
5415,1,Health writer  |  Media relations manager 
5416,1,"Employee benefits pro. Studies Scripture, leadership. "
5417,0,"Gamble & Schlemeier is Missouri's largest governmental relations firm. We represent trade associations, corporations and municipal governments across Missouri."
5418,1,"Element's is a premiere fitness brand for women. We help our members meet their goals! Nutritional counseling, exciting group classes & more! (517) 347-7945"
5419,1,"NDSU. Oncology and infectious diease. 3 majors in Chemistry, Biochemistry, and Microbiology. Work as medicinal chemist for NDSU, cancer cures. Boxing Captain."
5420,1,Dedicate health care and life sciences twitter page from Ocean Optics - the inventors of miniature fibre optic spectroscopy
5421,0,"Cure sometimes, treat often, comfort always. - Hippocrates"
5422,0,wedding photographer
5423,1,global health/social justice activist & Taiwanese-American queer feminist
5424,0,"Med# crypto trader&Analyst
"
5425,1,"Mom and night shift nurse, so basically I'm tired. seriously!"
5426,1,Million Dollar Rewards Program for Pharmaceutical Fraud Whistleblowers.
5427,0,"Excursions, Tour, airports transfers in Agadir Morocco"
5428,0,A competent authorised seller of Poisons based in the County of Narok.
5429,1,Find Health Insurance Work and Jobs at 
5430,1,"Proud Mama, health&wellness coach, lover of all things natural & green, real food-foodie, sweat addict, juice luva, side passion for marketing & design."
5431,0,Co-founder
5432,0,"Psicopedagoga, motivadora, Practitioner en PNL, Trainer y Coach Vibracional, certificados internacionales."
5433,1,"Husband, Dad, Academic Emergency Medicine and EMS Physician. Dabbled in Public Health. Former Director | Medical Director "
5434,0,Proud to be Egyptian
5435,0,truth and content - s.yablo 5
5436,0,"I'm soft,tender and straight forward... 
can be very subtle most times....
simple and smart!!!"
5437,1,Providing Customized Quality Patient Care Across The Healthcare Continuum
5438,0,"Graphic Designer, mac and tech geek. NFL and Washington "
5439,0, Community Food Systems Collaboration Specialist. Working on 
5440,0,Roman Catholic
5441,1,Resident doc 
5442,0,"Wife, Mom, and News Director "
5443,1,"Anaesthetist, Intensivist and a firm believer in the NHS. GenerationQ Fellow C7. Comments expressed are mine."
5444,1,"Sr. Recruiter, Nursing & Clinical Leaders at City of Hope, Reiki Master, single mom to 2 boys, opinions are my own "
5445,0,Professional 
5446,0,"I am a:
Christian, 
Husband,
Father,
Son,
Brother,
Psychology Instr, Trumpet Player, Beekeeper, & Fan of Solar Power and Science!"
5447,1,Associate professor in the Dept of Surgery at Baylor College of Medicine.  Board-certified surgeon specializing in  surgical oncology and pancreatic disorders
5448,1,"John Scotland CPA, CMA CEO Steeves & Rozema Group, Past Board Chair Ontario Long Term Care Assoc (OLTCA) Past Chair Health System Funding WG LTC at MOHLTC"
5449,0,Leader in 
5450,1,"Mom, Grandma, Radiologist"
5451,1,Its Ana with one N. Journalist covering health care 
5452,1,Homeocare International Pvt. Ltd brings Good Health & Well being from the groundwork of your body. It cures chronic and acute diseases with natural Homeopathy.
5453,1,"Future Cardiology | MEDLINE-indexed journal on advances in basic, translational and clinical cardiology research | Published by Future Science Group"
5454,1,23 - microbiologist - med student to be 
5455,1,My name is Isirene Ulloa-Gomez and I have an interest in nutrition and living a healthier lifestyle and pursuing a career in this area.
5456,1,"To address ATOD abuse concerns in Cass County and develop community  based strategies to prevent the problems associated ATOD, use, abuse and addiction."
5457,0,Designer at Web & Graphics + Do own  
5458,0,I'm just trying to survive in this jungle called life...
5459,1,The Little Book for Alzheimer's Caregivers by Celia Koudele - I am passionate about helping Caregivers of people with Dementia. 
5460,0,"Proud wife & mother, Jesus loving, essential oil using, daycare provider - that about sums up my life! Love my life!"
5461,0,I am passionate about helping others.
5462,0,What You Seek....Is Seeking You
5463,0,"Beware of being too rational .In the country of the insane,the integrated man doesn't become king .He gets lynched. An Economist, An entepreneur & A politician."
5464,0,Down to earth. Add me on facebook with Akinpelu Oladele Sheriff. Add me on BBM with my pin;5641DC42
5465,0,From a humble beginning...
5466,1,"Innovations in Health Communications Guidebook for health practitioners, researchers, and advocates. Created as a project of the OOMPH Program at UC Berkeley."
5467,0,"Now is the hour of pride and power,JUSTICE, TALON and claw!"
5468,0,"A  gospel artiste, books writer,blogger,webmaster,graphic design,sound / Image editor,  counsellor. TV Host, Chanel Manager."
5469,0,.....................................
5470,0,"Get free psychic chat readings, horoscope, tarot, free psychic chat, free psychic reading, discus with real person, choose a psychic you will connect with. Free"
5471,1,medical student 
5472,0,I 
5473,0,discovering love for words dog training movies plays books art outdoors travel cousins old friends new friends and sunshine anywhere I can find it!
5474,0,Lic en Administacion
5475,0,"Aviation, weather, more aviation"
5476,0,"   .!
 .!!        ..!!
 -  - .!!

    "
5477,0,Change agent and WE Hub Leader in NYC. 
5478,0,"Computers, Aviation, Exploration, Star Trek, Star Wars, Sci-Fi, Tech Geek, Books, and Enjoy chatting with people. Flying RC Helicopters."
5479,0,Tiki my Boston Terrier from Sunny Southern California...
5480,1,Therapy & Wellness
5481,0,Official Twitter account of Kinetico Corporate Headquarters -   LIKE us at 
5482,0,Proud D2 Legislative Aide to 
5483,0,MA real estate attorney. Crazy cat lady. Makeup junkie. Seeker of knowledge. Make your own fun.
5484,0,/ Erste Hilfe / Coaching / Beratung nach DGUV ermchtigte Stelle 8.0724
5485,0,CEO/Owner of a fully owned 
5486,0,", , , "
5487,1,"wife, mother, sister, aunt, nurse, proud liberal"
5488,0,Kingdom-minded woman of God! I love God!
5489,1,Urology
5490,1,Our purpose is to assist oncologists in providing the best care for their patients.  We provide SmartGen  NGS diagnostics and SmartPath - Pathology services
5491,0,willing suspension of disbelief
5492,0,GARAGE
5493,0,"PR, social media & design agency. Interested in architecture & design, food & beverage, culture, education, philanthropy, and all things NYC."
5494,0,Personal profile of West Michigan's Home Automation & Security go-to-gal. Providing solutions for all of your families life safety needs.
5495,0,"Regeneration architect, impact entrepreneur, futures thinker, "
5496,0,"Amy P. Kelly is a wife & mom of 4, w a passion for developing leaders, organizations & teams that positively impact the world. "
5497,0,Senior Executive with a passion for world-wide news. Working my dream job 
5498,0,"Life is worth living if there is purpose. Risk is a component of purpose. The older we get, hopefully, the more we minimize risk and culminate the reward."
5499,1,"An association of 6,000 nonprofit aging services organizations dedicated to an America freed from ageism."
5500,1,"Avid learner of resusc, airway and critical care FOAM. Never stop learning...and huge fan of my 3 favorite girls. Views are mine only."
5501,0,Ganador del Premio Lider Emergente. 
5502,0,Padre. Meteorlogo. Buscando ser piloto aviador. Plane spotter.
5503,0,Sakarya
5504,0,"Corporate Games, Inc. offers you the most efficient & entertaining ways to maximize face2face meetings & get your team to work together effectively "
5505,1,"BJS (formerly the British Journal of Surgery) is the premier peer-reviewed surgical journal in Europe, with an impact factor of 5.433."
5506,0,"Vice President
Healthcare IT 

accomplished Vocalist/Bassist

Historian/Political observer

Auburn BA History PreLaw
Tulane MBA
Pepperdine MA"
5507,1,Zebrafish Disease Models Society is dedicated to the advancement of basic and clinical research using Zebrafish disease models
5508,0,To be updated
5509,1,"Foodservice Express a division of Med-Diet, specializing in hard to find foods such as "
5510,0,I love my job and I love my animals. Maybe I'll even like you
5511,0,"Tragic Bulldog supporter and mad and bad punter who needs all the help he can but not from jockeys,trainers or owners Follow Spurs in the EPL"
5512,0,I am an Associate Broker at RE/MAX By The Bay - Fairhope on the Eastern Shore of Mobile Bay. I love selling real estate and enjoy taking photos!
5513,0,trying to perfect the ratio of daily coffee intake to nightly hours of sleep.
5514,0,"Author, Seeker of Knowledge, Upholder of Human Rights, Peace  & Justice for all regardless of race or religion.Interests: Arts, History, Science, Politics."
5515,0,VP of Training & Support at 
5516,0,Keep doing you... you never know whom you're inspiring
5517,0,"We welcome you onto the web portal and hope to make a positive difference to your life by serving you.   We are after all your friend, philosopher and guide."
5518,0,Easily-amused 
5519,1,The objective  of this jounal is promotion of rational use of medications in humans and utilization in therapeutics.
5520,0,Medico en proceso. Por ahora me la paso auscultando y conquistando corazones. Soy RH positiva. Estudia conmigo en 
5521,0,"conduit, politician and a social contributor"
5522,0,Perfectly imperfect.
5523,0,Ann Grice
