ID,hc_related,description
7683,0,"Without u my soul would be empty, my heart broken, my being incomplete"
7684,1,An orthopedic surgen R5
7685,0,Jadikanlah kekecewaan masa lalu menjadi senjata sukses dimasa depan. ITB Teknik Pertambangan *flex*
7686,1,"Care Management Services provide senior adults the opportunity for Independent Living at Home instead of nursing homes or ALF's.
https://t.co/LQnZbfW22F"
7687,1,Forum Healthcare Services is on the leading edge of healthcare staffing because of our ability to present you with the right candidate for your staffing needs.
7688,1,Establish Detroit as a biomedical research training center for underrepresented undergraduates #UDMDetroit #waynestate
7689,0,"An administrator,Economist and a human right activist."
7690,0,"auditor and financial consult
ant aiming to be the best consultant n help people pr
actice good financial and accounting polices"
7691,1,I am currently in my last semester at ASU working towards my bachelor's in Health Science. This twitter account was created for school purposes.
7692,1,"Solo Family Medicine physician,  international expert in infection prevention and creator of Henry the Hand Champion Handwasher."
7693,0,Guardian of the Third Amendment
7694,0,A.C. Sin fines de lucro que promociona espacios para la cultura en la comunidad de la Quizanda.
7695,1,"Prodigy Associates is an MBE staffing, consultancy, mgmt, & recruiting service provider which specializes in consulting, Temp to Perm, Permanent Placement."
7696,1,Jordan's wife. Beagle mom. Coffee addict. Jesus lover. Nursing student. Professional napper.
7697,0,saro
7698,0,"Have 5 grandchildren. Love music.Been singing,  playing piano & organ & performing since I was 10. Love dachhounds."
7699,1,Tech Geek | Productive Disruptor | Skier | Sailor | Dog Lover. Dedicated to making healthcare easy to navigate & more affordable with better outcomes.
7700,1,"Board-Certified Orofacial Pain & TMJ Specialist  NYC Private Practice  Attending, Yale-New Haven  
Treating patients with #tmj, #facialpain, #headaches"
7701,0,Lover & Fighter 
7702,0,BC 15 
7703,0,"Mdica dermatologista, professora da Faculdade de Medicina Estadual de So Jos do Rio Preto, proprietria da clnica Unidermato."
7704,0,Center for Environmental Nanoscience and Risk (CENR)
7705,1,"Brazilian, medical student, currently in New York for a summer internship at Weill Cornell Medical College - New York Prebysterian Hospital."
7706,1,"Diagnosed with Colon Cancer at the age of 45.. Ran 23 1/2 marathons, 1 marathon, and one 100 mile Ultra!! cancer free..woke up to LIFE!"
7707,1,"Orthopedic hand and upper extremity surgeon in Arlington, VA."
7708,1,"Cardiac electrophysiologist, scientist"
7709,1,Pediatrician. Advocate w a passion for #Latino #Health & #ChildhoodObesity #Prevention Promoting healthy lifestyles through @UCHC_Bronx #SSBFree & @TheBronxHBZ
7710,1,Voted One of Central Jersey's Best Physical Therapy Offices by The Home News Tribune
7711,0,"I love dogs and cats, and I also love playing with my cousins and my friends."
7712,0,"Conservative practicing Christian, DOG lover, singer, music lover, reader, RV camper, knitter, organic gardener, widow"
7713,1,"Seeking solutions to public health challenges with data, innovation, & communication. Opinions mine, retweets theirs. [crowd photo by J Cridland]"
7714,1,"Find prescription medications, cures, treatments and remedies for your heartburn, acid reflux and GERD.  Cures from a chronic heartburn sufferer."
7715,0,Hospital Management - Gestion hospitalire - Health Care Management - Gestion des systmes de sant
7716,0,"I Treat Each And Every One As I Want To Be Treated, With The Utmost Respect And Dignity!!!(((HUGS)))
Thank You Very Much For Following Me!
God Bless You All"
7717,0,"Instituto Pblico Minero del estado Bolivariano de Gurico
Ciudad Olmpica, San Juan de los Morros"
7718,0,"Researcher,business innovator, Youth activist and peace developer, Member of AU-YVC #YALI , Founder &CEO  #Childhope_Africa."
7719,1,St Francis Hospital
7720,0,"Our Mission at PCCenter is to inspire, support, and prepare students in order to promote lifelong learning and career achievement."
7721,0,Metro editor for the Akron Beacon Journal/Ohio.com
7722,0,"I'm a Southern,gal with simple taste and small town values! https://t.co/xaABCmlOUw"
7723,1,"A group of individual, relationship & family therapists thinking out loud."
7724,0,"Vice President, Engineering Fellow, Discern, @Cerner. Husband, father and UMKC grad."
7725,0,"Uplift Professional Network
Together Bridging the Employment Gap We offer Per Diem Shifts, Contract to Perm, Contracts 
Staffing in LTC Facilities and Hospitals"
7726,0,feminist + techie
7727,0,LHS | '17
7728,0,adv.kamlesh
7729,0,Facts do not cease to exist because they are ignored.
7730,0,I'm a dawg! Ruff-Ruff!
7731,0,"The Office of the Commissioner, An IGO #theocanigo Striving for a Better Tomorrow for All Humankind & A Just World!!"
7732,0,"RezBerry Ultra is the number one superfood - balance your metabolism, highest antioxidant rating, slow down the aging process and promote healthier, clear skin."
7733,1,FDA Approved! 1350 Highest Therapeutic Laser (D3LT) Patented F/Vet Industry  Treats directly on #Spine #Hoof #Bone #Muscle #Ligaments
7734,0,gbc till I rest. 
7735,0,"I am a wife, mother of two teenage boys, elementary school  teacher. I  teaching 3rd grade at Burlington Elementary in Burlington, Kentucky."
7736,0,"My conscience before God is my most treasured asset.In Him I live, move and have my being"
7737,0,never chance
7738,0,"Emma mi ms grande amor   
Mis Sobrinos son mi "
7739,0,Conservative / eubloqueiopetralhas retweet#endorsement / https://t.co/Gvna0mb5kL
7740,0,"Writing my first historical novel. Wrote vintage postcard book, The Blue Ridge Mountains of North Carolina. Follow my blog: https://t.co/zITEctZC3M"
7741,0,God lead my way I am on process  for success.
7742,0,Philips POCUS
7743,0,MYWALLET: Super Slim Aluminium Wallet. #mywallet #cardholder #cardwallet # # #
7744,0,Brave to Face The Reality 
7745,1,"#SustainableHealthcare #engineer, #lifecycle specialist, #photographer, world traveler, human being. #clinicallysustainable"
7746,0,"SNAP| monsterbart 
"
7747,1,"#PATIENT LISTENERPhysician ResearcherGlobal President, R&D @Pfizer Essential Health RTendorse OwnViews"
7748,0,I'm weird
7749,1,"Alaska Northern Lights is an online retailer of bright light therapy boxes for treating seasonal affective disorder, depression, sleep & mood disorders."
7750,1,Senior Exec. CEO @AInsightCare enthusiast for #machinelearning #ai #biomarkers #radiology
7751,0,artist
7752,0,Hi!
7753,0,"Interested:Nature,Science,Sustainability Tech,Agriculture,Agroforestry,OrgFarm,Permaculture,GreenRoofs,Wind/Solar RadioPressLibrariesMuseums. Games,Art/Music."
7754,0,"Former radio announcer, associate editor at a magazine and assignment desk editor at a newpaper now tuckpointing."
7755,1,"US MedIntel's data is the most accurate, complete & current Medicare claims data on the market. Gain instant insights via our online portal."
7756,0,Executive Director Southeast Florida Lions Foundation
7757,0,Artist formerly known as Kristie  UX/UI Designer / Wifey / Reiki Master / Scorpio / Scent-Seeker / Ghost Magnet / #CelebrityHusband Collector / #BHLove  xo
7758,0,good conservative
7759,0,"Dog Lover, Theater Tech, Media and Development Consultant, Owner of @PrimeWorksGroup."
7760,0,"mom, reporter and all around news junkie."
7761,1,A cross-institutional initiative to study and implement ways to better integrate religion and spirituality into the practice of medicine and public health
7762,1,"PGCE primary Ed, MSc Health Psychology and UKCC L2 in Judo. Increasing fitness of children and adults with Judo."
7763,1,An Innovative CO2 Absorbent #MadeInAmerica #CostEffective #Anes18 Anesthesiology https://t.co/t0RyQfR6P2
7764,0,Music is my life (the legal profession is an hubby)
7765,0,More than cool personality and highly opinionated |Lover of communication |
7766,1,Information regarding early stage identification of Breast Cancer.
7767,0,"Live, Love, Enjoy and Promote the law"
7768,1,Medical student
7769,0,Stratford School is an independent private school serving children in communities throughout the SF Bay Area. The best preparation for a lifetime of learning.
7770,0,Known Inventor partnered with a Harvard MBA to help other inventors thru the twists and turns of this business.
7771,1,Unrepentant healthcare geek. Explorer. Author. Working to improve access for the underserved in the Bay Area. Ex-McKinseyite. Views are my own.
7772,0,"at the cross-roads between human-centered design and management consulting. 
SEEK | UNDERSTAND | DO"
7773,1,"Sports PT Resident at Hospital for Special Surgery,  UConn alumn"
7774,0,"Computer scientist from Paris VI university : now university teacher, President & CEO of KittyCorp."
7775,0,"Child of the King, Motivated, Motivator, Empowered, Upcoming Author and Founder of The Voice of Encouragement (text & email) Ministry."
7776,1,"Assistant Professor at National Tsing Hua University, studying heterogeneity/gene expression/signaling in cancer. Formerly @UVA & @NCState."
7777,1,A group of determined scientists constantly looking for new methods to analyze data from the brain and convert it into useful practice.
7778,0,tudiant  la Facult des sciences juridiques politiques et sociales tunis
7779,1,Studies Doctorate in Critical Care @ Barry University.
7780,0,"Me, Myself, I Love My Life, My Family, My Baby, My Friends And Club Chelsea Fc. Any Problem With This? Go Fuck Yourself."
7781,0,Ahmed Altuwaijri
7782,1,Arizona State University Student studying Global Health with a minor in Nutrition & Healthy Living with intention of a Masters in Physicians Assistance
7783,0,Etudiante en Physique.
7784,0,"Single........
Aries..........
Chemist..... 
Eccentric.... 
Believer in God......."
7785,0,"Hannah 28yr old Mississippi girl, Louisiana Woman. Love to Travel anywhere & visit some old favorites. Psychology Mjr w/ Political Science Minor."
7786,1,"An award-winning community hospital serving Tuscarawas, Carroll and surrounding counties, and now a part of the @ClevelandClinic healthcare system."
7787,1,"I save lives for a leaving. What do u do? RN,BNSC,MSC. Occupational Health and Safety Nurse, Accident and Emergency Specialist"
7788,1,"Integrative Psychologist and Acupuncturist, also specializing in Herbal Medicine, Biofeedback, Meditation, and EFT"
7789,0,charles investments
7790,0,famlia
7791,0,Co-Founder International Music Community (Social Change arm)
7792,1,"Speaker, Physician, Researcher & Innovator"
7793,0, I proudly work in the specialized transportation industry for the past 29 years plus serving the U.S. and Canada
7794,0,Voice for Truth. Balance for Power. A Champion for Justice. Trial lawyer. Husband. Father of three. Lover of life.
7795,0,"23ans,Mother Algerian/Francaise, French Citizen,Father, English. love playing with strong strict people."
7796,0,ask if you want to know!?!
7797,1,BioScience Writers provides premier scientific language editing and writing services to the global scientific community.
7798,1,"Lab Manager and neuro scientist, sweet as pie on the outside. Her true form The Crafting Crone; has too many fabric scissors...she grrrrrummmpy."
7799,0,In the Moment.
7800,0,"If you think anything hard that's not possible to you, as if easy that's all time be possible any work."
7801,1,Healthcare Leader | Community Volunteer | Brother | Friend |
7802,0,Dreamer.... Turn dreams into reality..
7803,0,Hard to define what i really want .. just random thoughts
7804,0,O amor rompe todas as barreiras que os obstculos coloca em nossa vida..
7805,1,"Med Onc registrar: NIHR ACF (interests: DNA repair pathways, NET, lung cancer, liver directed Rx, PROMs). RMPartners Research Fellow at Imperial College. #PMGUK"
7806,0,"hvac tech, father ,husband to a great wife and mother, I like clean content, food, family oriented things. if u don't, you are blocked ,#jw #godawgs #georgia"
7807,0,"#1 Nigerian online Mart. Our products:  . Our service: hotel booking & Web hosting.

Enquiries: Afrincegroup@gmail.com or WhatsApp 08119307939"
7808,0,HEALING FROM THE CORE
7809,1,PhD AdvAPD Nutrition & Health Prof Education. Senior Lecturer/Researcher who loves #Weimaraners Melbourne Australia @MonashNutrition @SCSMonash #FLFoodAsMed
7810,0,Sleepy 24/7
7811,0,"Translation Organisation  Since 1980 -      1980 - 
.: 210.82.21.571 - 
e-mail: eurocentre@translation.gr"
7812,0,The sweet life......so simple and so me!!!
7813,0,Don't judge somebody just because they sin differently from you...
7814,0,Founder/General Manager - Nutriwealth Multi-Purpose Cooperative; Marketing Director - International Marketing Group (IMG)
7815,1,Double board certified plastic and general surgeon practicing in West Palm Beach 25+ years. National and International lecturer. #PalmBeach #Jupiter #Wellington
7816,0,Owner @SkidmoreClinic. Team Physio Irl WU17 @FAIreland  Club Physio @CobhPiratesRFC  APPI Pilates Instructor. #FamilyFirst
7817,0,just a girl trying to find herself
7818,0,"Adventurous, happy mother"
7819,0,"Associate Editor, Outdoor News Publications"
7820,0,Cinematographer @tinbite-films
7821,0,Stake big and win big by playing https://t.co/EvpZuncUaE | For More Info : info@winnersgoldenchance.com
7822,0,"A brother, a son, a friend."
7823,0,I am from America and I love One Direction
7824,0,A pajama model who loves eating pudding with a plastic spoon!
7825,0,"Ob-la-di, Ob-la-da, life goes on"
7826,0,Follow : @sylvi28baale | Ask.fm : @sylvi_28 | Facebook : Sylvi Faujiah | Email : SylviFaujiah@gmail.com | Gamsa - Hamnida :)
7827,1,I am a single mother of 5 amazing kids.They keep me fighting.I fight Stage IV Metastatic BC. I have the best care in the world. Dr. Chau Dang #stageivneedsmore
7828,1,Recovery Partner  - my passion is helping people beat addiction and regain control of their lives
7829,0,"Justin me segui

manda nude"
7830,0,Creating a Sustainable Future Through Education
7831,1,MD
7832,0,"Nutricionista , Directora de Pregrado FAMED U de Chile. Runner retirada e hipertensa en fase de negacion, el resto ... es https://t.co/KnKuzGCbJ9 Donante #esonomaslesdigo."
7833,1,"A boutique healthcare agency, focused on the needs of the medical industry, from coverage to legislation, with a direct, personal approach."
7834,0,Hotel Real Estate
7835,0,.
7836,1,"Mom, nurse, rider of bikes, eater of food & lover of all things fun. Parenting an #AYA  #netcancer kiddo. Life's short. Live like you mean it."
7837,1,"I am a Physician in India / A consultant in intetnal medicine. I like Reading, indian classical music, new age music . I always search spiritual men and women."
7838,0,"They told me to take a streetcar named Desire, and then transfer to one called Cemeteries and ride six blocks and get off at Elysian Fields."
7839,0,"My Name is Emmanuel Adedoyin, my nickname is Walexaddy, born in Ijebu Ogun state on 27th of April 1998. Presently a Student. BBM me: 5C1B229B"
7840,0,i want to meet the impractical jokers.
7841,1,"JWH is a Medical Recruitment Agency based in Sydney, established in 1989. We specialise in placing candidates in their perfect roles all over Australia and NZ."
7842,0,A Mississippian in Utah!  Conservative.
7843,0,ben futbolu cok sevyorum
7844,0,Web Service Rep@  BARNEYS New York Author A Book of Musings and Other Writings & Coloring Book on https://t.co/GHrTzR9xA4
7845,0,Manager of Epic Delivery for Alidade Group. Specialized in Epic Workforce Planning and Talent Delivery. Expert in designing high performing teams.
7846,0,Working at the intersection of technology and humanity to help leaders transform their organizations to survive the future
7847,1,"Passion for scientific/technological advances impacting healthcare quality,continuity,coding,IT,security,EHR&more."
7848,0,ok
7849,1,Sonia is recognized as one of the leading experts in hCG diet research and weight loss safety and co-authored the clinically proven HCG 800 Calorie Protocol.
7850,0,Enredado pragmtico
7851,0,trust God that i am exactly where i am meant to be...
7852,0,"TEFL graduate phuket Thailand Center , English language Teacher Assumption College phuket. President of Ngwokwong Tugi youths Association Douala."
7853,1,"Heart 'n Home affirms life by providing emotional, physical, and spiritual support to our patients and to those who love and care for them."
7854,1,Laughing with Lupus.
7855,0,Turn your eyes upon Jesus look full in his wonderful face and the things on earth will grow strangely dim in the light of his glory and grace.
7856,1," BSN, RN | Adventurer | Bucketlister  Instagram: emersonarchie"
7857,1,"Online tool supporting min level #diabetes skills for all HCPs to improve quality, safety & outcomes. RCM, RCN, RCP & RCGP accredited. DUK, CUHP & BDA endorsed."
7858,1,"Aligned Telehealth, Inc. is a National Behavioral Health Hospitalist and Telemedicine Company"
7859,1,"Senior Director, Research & Development.  Love reading, listening and sharing news and updates on cell therapy. 
Disclaimer - this is my personal account."
7860,0,Love and live your life
7861,0,Corfu Massage Therapy offers an professional to your door'' massage service at an reasonable price for anyone visiting or living on the island.
7862,1,Under The Tree BioPharmaceuticals is a pharmaceutical company specializing in the research and production of cannabis derived therapeutics.
7863,1,"Best Selling Author, ""Unbreakable Spirit-Rising Above The Impossible"".   A 4-time, Stage IV breast cancer survivor and patient advocate."
7864,1,"Using the power of music to heal, encourage, and enlighten."
7865,0,sabah
7866,0,Doctora  & Regia 
7867,1,Innovative Health & Wellness is the medical practice of Dr. Stephen Silverstein and Dr. Scott Silverstein.
7868,0,Managing Partner- Crowe Maldives LLP. #audit #tax #advisory
7869,1,"Congenital Heart Defects, psychology, education, SEND, qualitative research, pro-EU, Archers addict, Border Collie fan"
7870,0,USMLE5
7871,0,Humble beginnings Birmingham AL | @AuburnFootball #WarEagle | Pulled shifts in the USNavy | The biggest thing you can do today is a small act of kindness.
7872,0,NSC Webinars: Need training ASAP? Stay current on upcoming Webinars for creating safe environments at work and off the job.
7873,0,"Designer, writer, maker, destroyer of vowels. Mgr of Brand & Innovation @VanIslandHealth, Board @CCHL_VanIsland, CEO @AdaptiveImpact, Founder @cora_luma/#BeLeaf"
7874,0,Unity is power!
7875,0,masjid line hat bazar kurseong darjeeling 734203
7876,0,Tec quiropedista
7877,0,bettycombs721@gmail.com
7878,1,Surgeons and the CRF performing surgical trials - ours and others. Happy to retweet
7879,0,https://t.co/vHe7AQycwU
7880,1,The #HealthyMaterialsLab formed to build healthier lives for all people through the dramatic reduction of toxics in the building industry.
7881,1,"NEHII provides secure exchange of important clinical information among physicians and other health care providers, real time, at the point of care."
7882,0,"Communications leader, @UN_Women global champion, D&I consultant. Author #AllInBook on dads & gender equality. CNN & NPR alum. https://t.co/2F2IAw0E8l"
7883,1,News for physicians and scientists about @MDAndersonNews' progress in the fight to #endcancer. Refer a patient: 1-855-656-5880
7884,0,Giving tips of the trade to help make your office efficient and make life just a little easier.
7885,1,"Making my invisible,visible through the Power of the Holy Spirit  and the Rosary Brainstem Injury; Cranial/Spinal CSF LeaksDysautonomia, EDS, Chiari."
7886,1,The Rolfe Foundation is dedicated to supporting programs specifically in #EarlyDetection #PancreaticCancer research and patient services.
7887,0,Project Manager - Financial Planner
7888,1,CPR and First Aid Training across South Carolina
7889,1,"Nurse, Bachelors in Health Care Adm."
7890,1,"If I Worried About Other Bitches, I Would Be Just Like Them, Another Worried Bitch. Here To Save Your Ass Not Kiss It. #Bulls Nation #RN-BSN"
7891,0,Living life in the fringes!
7892,1,"Musings & reveries by a Jersey girl ~ daughter, sister, friend, leader & an Onc RN who enjoys every second that life has to offer-my tweets are my own"
7893,0,Leave life just ready to learn.
7894,0,Organizing the power of volunteers while utilizing donors to serve individuals and families in time of need.
7895,1,coffee lover | 3yr student doctor | Master of My Seas | healthy Obsession with Martha Stewart
7896,0,#film # # # # # #rufollow #followback #rufollowback
7897,0,"Breyona
1time
t"
7898,1,Grandma of 9 (ages 8 to 4 wks) and a nurse.
7899,0,"gardening, reading all kinds of gardening books, bird watching everyday, and above all I LOVE DOGS, I miss Chloe, and for the past year I have been quilting"
7900,0,Welcome to the Amaica Experience  - Authentic African food | Warm African Hospitality | Traditional African Ambiance
7901,1,"Rowan University BA Psychology, LIU Post MS Mental Health Counseling Class of 2016, PCOM clinical psychology PsyD Class of 2021"
7902,1,"Health improvement, food, fun, and friends at The Clubhouse and Help At Home Services at your house!"
7903,1,"The Liddy Shriver Sarcoma Initiative is a global charity that offers support, provides expert information and funds promising sarcoma research."
7904,0,      .
7905,0,Mdico Endocrinologista da Universidade Federal do Cear
7906,0,RETOX|REAL WELLNESS for REAL LIFEBest Selling Book in 4 Languages#RETOX
7907,0,"Rajshahi Outsourcing Institute 
 361,ABOSHOR,HatemKhan,Kalabagan BORNALI MORE Rajshahi-6000.
 Phone No.: 01924-474467, 01511-302989"
7908,1,"Emergency Medicine, #FOAMed #clinicalskillz"
7909,0,Work deserves to be meaningful. Make it so with Industrial-Organizational Psychology.
7910,1,"Field Hockey Coach, Healthcare Operations & Recruitment, Sports Fan."
7911,0,Missy Bradley-Ball and https://t.co/F3z7j7zKH0 helps you discover resilience and to strengthen your abilities to live a vibrant heroic life.
7912,1,writer. physician. baba. music lover. literature fiend.
7913,1,"21ys _5th year , kasr alainy medical school / volleyball , violin , swimming, aerobics ,The Holy Quran , reading & music"
7914,0,"there is no limit to life, where there is life and good health I will break through the skies in Jesus Christ's name!!!"
7915,0,"Smarsh helps regulated organizations capture, archive and supervise the newest communication channels to meet compliance and e-discovery challenges head-on."
7916,0,"Nerdy lady, former librarian & coder, kitty momma, Whovian, gardener, devourer of SF, fantasy & mysteries. Warning - forward liberal stuff!"
7917,0,love
7918,0,"God grant me the serenity 
to accept the things I cannot change; 
courage to change the things I can;
and wisdom to know the difference."
7919,1,QuiO aggregates digital health data and integrates clinically-meaningful insights into the remote care workflow
7920,0,Hi
7921,0,"We talk Naija, We tweet Naija, We are Naija"
7922,0,te amo justin bieber
7923,1,Serial Entrepreneur; Physician; Investor; Health and Wellness; Personal Health Ecosystem; Precision Health; VHG; Dad
7924,0,YMCMB - OVOXO
7925,1,"Dr. McArthur specializes in hip & knee replacement surgeries, including revisions of prior replacement surgeries, & hip preservation surgery."
7926,0,"Arts Reporter for NYPress: Our Town, West Side Spirit, Our Town Downtown, Chelsea News. Formerly @TIME."
7927,0,NACI 6 DE SEPTIEMBRE
7928,0,Contact us to sell our amazing Jewelry @ your next  Fundraising Event to Raise Money for Your Cause
7929,0,Call for Backup
7930,0,"""Que extrao es el ser humano. Nacer no pide, vivir no sabe y morir no quiere, extrao en verdad."""
7931,1,"Nurse, former news photog, ocean lover, on a quest to find good food"
7932,0,"We believe, given the proper support, manufacturers can grow strategically, improve profitability, and create competitive advantages."
7933,0,https://t.co/ehGUzzIHTI
7934,1,IT Senior Manager at UC Davis Health. Enabling Health Tech focused on #PopHealth #Telehealth #Wearables  #ValueBasedCare
7935,0,Cantante y compositor urbano. sigueme y te sigo
7936,0,retwetteo de todo. Me un el 11.08.2015
7937,1,"Using advanced practices and equipment, we offer you and your family the highest standards in foot care  Serving residents in Twin Falls and Burley, #Idaho "
7938,1,"Official Twitter source of the Community Preventive Services Task Force (CPSTF), providing evidence-based recommendations for public health."
7939,0,"RDs,CDNs,CFTs, #Nutrition #Fitness #WeightLoss #Veggies #Metabolism Media/TV Contributors, 3X #Authors, #Speakers Social Media Influencer-3.7M+Pinterest Follows"
7940,0,Life is all  about  u friends
7941,0,mister
7942,1,"Animal lover, Severe Migraine Sufferer,  & Chronic Pain.Product Reviewer w/Blog."
7943,1,University of Toledo Alum. MICU RN BSN: The Ohio State Wexner Medical Center. Let's see the world- together. Be KIND.
7944,1,Education | Prevention | Community Focused | Comprehensive care of bone & joint problems & sports related injuries in children & adolescents.
7945,1,"Health communicator whose current aspirations include: conquering PLNK bears, finishing NYT crosswords and being the cool aunt. Viewsmine. #payitforward"
7946,0,I`AM A Child Of The LIVING GOD THE MOST HIGHLY WHO KNOWS ALL THING'S!!!! I Am A Person who is ready to be met in life half way Doing New an Bigger things!!!!
7947,0,Unworthy Child given Grace by God:)
7948,1,"Psychologist, health coach, teacher, writer. I follow back."
7949,1,CSULB Nursing
7950,0,"hi ,I like learning by listening your lessons"
7951,0,"Daily news on mortgage. deals from moving companies, moving and storage containers, moving helpers, box . find furniture, go furniture buying."
